id,title,text,source,source_type,url,date
885a36b576b0,Siemens OPC UA and .NET C# client can not connect to server?,"I tryed to connect to OPC UA server using the client provided on this page: https://support.industry.siemens.com/cs/document/42014088/programming-an-opc-ua-net-client-with-c%23-for-the-simatic-net-opc-ua-server?dti=0&lc=en-US . Connection to OPC UA server using the Siemens OPC Scount v10 works fine. When connecting to the OPC UA server using client provided in the article, I get this message: Could not open UA TCP request channel. Stack trace of the exception is this: Server stack trace: at Opc.Ua.Bindings.UaTcpRequestChannel.OnEndOpen(IAsyncResult result) at Opc.Ua.Bindings.UaTcpRequestChannel.OnOpen(TimeSpan timeout) at System.ServiceModel.Channels.CommunicationObject.Open(TimeSpan timeout) at System.ServiceModel.Channels.ServiceChannel.OnOpen(TimeSpan timeout) at System.ServiceModel.Channels.CommunicationObject.Open(TimeSpan timeout) at System.ServiceModel.Channels.ServiceChannel.CallOpenOnce.System.ServiceModel.Channels.ServiceChannel.ICallOnce.Call(ServiceChannel channel, TimeSpan timeout) at System.ServiceModel.Channels.ServiceChannel.CallOnceManager.CallOnce(TimeSpan timeout, CallOnceManager cascade) at System.ServiceModel.Channels.ServiceChannel.EnsureOpened(TimeSpan timeout) at System.ServiceModel.Channels.ServiceChannel.Call(String action, Boolean oneway, ProxyOperationRuntime operation, Object[] ins, Object[] outs, TimeSpan timeout) at System.ServiceModel.Channels.ServiceChannel.Call(String action, Boolean oneway, ProxyOperationRuntime operation, Object[] ins, Object[] outs) at System.ServiceModel.Channels.ServiceChannelProxy.InvokeService(IMethodCallMessage methodCall, ProxyOperationRuntime operation) at System.ServiceModel.Channels.ServiceChannelProxy.Invoke(IMessage message) Exception rethrown at [0]: at System.Runtime.Remoting.Proxies.RealProxy.HandleReturnMessage(IMessage reqMsg, IMessage retMsg) at System.Runtime.Remoting.Proxies.RealProxy.PrivateInvoke(MessageData& msgData, Int32 type) at Opc.Ua.ISessionChannel.CreateSession(CreateSessionMessage request) at Opc.Ua.SessionChannel.CreateSession(CreateSessionMessage request) at Opc.Ua.SessionClient.CreateSession(RequestHeader requestHeader, ApplicationDescription clientDescription, String serverUri, String endpointUrl, String sessionName, Byte[] clientNonce, Byte[] clientCertificate, Double requestedSessionTimeout, UInt32 maxResponseMessageSize, NodeId& sessionId, NodeId& authenticationToken, Double& revisedSessionTimeout, Byte[]& serverNonce, Byte[]& serverCertificate, EndpointDescriptionCollection& serverEndpoints, SignedSoftwareCertificateCollection& serverSoftwareCertificates, SignatureData& serverSignature, UInt32& maxRequestMessageSize) at Opc.Ua.Client.Session.Open(String sessionName, UInt32 sessionTimeout, IUserIdentity identity, IList`1 preferredLocales) at Opc.Ua.Client.Session.Open(String sessionName, IUserIdentity identity) Any help would be appreciated. OPC UA server runs on Siemens Simatic HMI TP700 Comfort. Configuration on the OPC UA server is default. After andrewcullen tip, we are getting the below log in the tracelog.txt file and error when catching the exception that says An unexpected error occurred while connecting to the server. PID:4196 ************************* Logging started at 02/03/2016 07:41:34 ************************* 4196 - 07:41:38.742 GetEndpoints Called. RequestHandle=1, PendingRequestCount=1 4196 - 07:41:38.992 SECURE CHANNEL CREATED [TcpClientChannel UA-TCP 1.00.238.1] [ID=12752] Connected To: opc.tcp://xxx.xxx.xxx.xxx:4870/ 4196 - 07:41:39.008 TCPCLIENTCHANNEL SOCKET CONNECTED: 00000698, ChannelId=12752 4196 - 07:41:39.008 SECURE CHANNEL CREATED [Opc.Ua.ChannelBase WCF Client 1.00.238.1] [ID=] Connected To: opc.tcp://xxx.xxx.xxx.xxx:4870/ 4196 - 07:41:39.101 GetEndpoints Completed. RequestHandle=1, PendingRequestCount=0 4196 - 07:41:39.132 TCPCLIENTCHANNEL SOCKET CLOSED: 00000698, ChannelId=12752 4196 - 07:41:44.230 Writing rejected certificate to directory: 4196 - 07:41:59.694 CreateSession Called. RequestHandle=1, PendingRequestCount=1 4196 - 07:42:13.672 TCPCLIENTCHANNEL SOCKET CLOSED: 000007C0, ChannelId=0 4196 - 07:42:13.750 CreateSession Completed. RequestHandle=1, PendingRequestCount=0 I got the answer from the Siemens official support: The application was not tested with Comfort Panel. The code e.g. contains Block Read and Block Write which is not supported from the Panel Server. So this application will not work.",Stack Overflow,community,https://stackoverflow.com/questions/35134614/siemens-opc-ua-and-net-c-client-can-not-connect-to-server,1454341717
361a77c98e3e,Serial communication between Siemens PLC and Arduino,"I want to have a serial communication using Siemens S7-1200 with CM 1241 (RS-232) and communicate with my Arduino. Here is the setup of the communication. I have 2 temperature sensor and one Led connected to my Arduino, and on the PLC side I have S7-1200 from Siemens and CM-1241. Arduino and my PLC are connected just by using Tx and Rx pin no handshake is done. I am sending the temperature data from both the sensor to the PLC. on the PLC side i decide when to turn on the Led connected to my arduino depending on the different temperature values. I have assigning a ID to both the sensors before sending out the data. This is how the transmitted data from Arduino looks like $AOPT_TEMP1_20_TEMP2_21 . So far its good, I am receiving serial data on my PLC using RCV_PTP (received data are placed on the buffer) and sending data using SEND_PTP. I have also implement a filter on the PLC which will only accepts the serial data starting with '$AOPT_'. Now, I want to receive the temperature value from two temperature sensor TEMP1 & TEMP2 and then control the Led. For instance if (TEMP1>TEMP2 ) then turn ON the Led else turn OFF. I am able to receive the data on the PLC from Arduino but now I don't know how to proceed with comparing the received information. How do i extract the only required data from the received buffer? Any suggestions will be highly appreciated. Thanks in advance....",Stack Overflow,community,https://stackoverflow.com/questions/32428430/serial-communication-between-siemens-plc-and-arduino,1441574580
e8b962f90afc,SQL-Siemens PLC connection,"Actually, I am working on the connection between S7 1500 PLC and SQL server I can send and receive data successfully. I build a table in the SQL server(product ID, product, quantity, product Key). many products can have the same Product Key. I need a command in the PLC Like Insert FROM TestTable WHERE product Key=5000' that gives me all the products with a product key=5000",Stack Overflow,community,https://stackoverflow.com/questions/68206741/sql-siemens-plc-connection,1625127681
f33b4484eaeb,Siemens PLC S7-1200 - Connection to internet via server,I have made the s7-1200 webserver and want to access it from a remote location in addition to configuring the PLC program if needed. The PLC has access to internet through a router at the location. I do not want to use VPN or port forwarding. I want to rent a server and access the PLC through this server. Typically: https://host1.no/client/cart.php?language=English&gid=15 . Question: What siemens-equipment is needed for me to connect to that server through internet such that I can connect to that server with any PC and access the PLC webserver and also compile new programs to the PLC.,Stack Overflow,community,https://stackoverflow.com/questions/41243473/siemens-plc-s7-1200-connection-to-internet-via-server,1482240418
898653dd0379,C# and Siemens PLC communication,"Does anyone know a C# read data command will take place in which step of PLC cycle? The PLC process steps are: The operating system starts the scan cycle monitoring time. The CPU writes the values from the process-image output table in the output modules. The CPU reads out the status of the inputs at the inputs modules and updates the process-image input table. The CPU processes the user program in time slices and performs the operations specified in the program. At the end of a cycle, the operating system executes pending tasks, such as the loading and clearing of blocks. The CPU the goes back to the begining of the cycle after the configured minimum cycle time, as necessary, and starts cycle time monitoring again. My purpose is to find out how a C# application can affect on PLC CPU scan cycle time.",Stack Overflow,community,https://stackoverflow.com/questions/73106848/c-and-siemens-plc-communication,1658741039
56891f98a706,PLC Siemens S7-1200 and TIA Portal - Change IP address,"I'm having a strange problem with TIA Portal and S7-1200 Siemens PLC. I need to change the IP address of PLC, but I have not TIA Portal project of the machine. I tried using Online access > Diagnostic > Functions > Assign IP Address but TIA Portal says ""the IP address could not be assigned"". The IP has to be changed from 192.168.50.xyz to 192.168.40.xyz Tia version is v17 both on PLC and pc. What I checked: I can ping the PLC; I can view program blocks in PLC; I can start / stop the PLC. Any help would be appreciated.",Stack Overflow,community,https://stackoverflow.com/questions/73699637/plc-siemens-s7-1200-and-tia-portal-change-ip-address,1663056896
49812f2343a8,Determine whether Siemens S7 400 PLC has Memory card from Project,"Does anyone know if I can determine whether a Memory card is installed in a Siemens PLC from the Step 7 Project? Thanks, GLMT",Stack Overflow,community,https://stackoverflow.com/questions/21758188/determine-whether-siemens-s7-400-plc-has-memory-card-from-project,1392304622
7c8e9f8da82c,Efficiently Reading Structured Data (Zones & Heaters) from Siemens PLC in Node-RED,"I'm new to Node-RED and Siemens PLCs, and I'm using the node-red-contrib-s7 node to communicate with my PLC. Currently, I can successfully read and write data to individual records in a data block. Problem : I don't want to create a separate node for every variable because: More records will be added in the future. (New zones or added heaters to a zone etc) There are already many records, making it inefficient to manage manually. Data Structure: I have an array called zones, where: Each zone is a struct containing multiple heaters. Each heater also has associated data (e.g., temperature). Goal: I want to read the entire array or at least an entire zone at once. Ideally, the data should be structured as a JSON object, where each zone contains all its heaters and their respective data. This data will be used to display a real-time dashboard showing: The current temperature in each zone. The status of each heater. Issue: The node-red-contrib-s7 node doesn't seem to support reading entire structs, objects, or arrays at once. I haven't found a way to loop through the zones efficiently within Node-RED. Question: How can I efficiently read the entire array (or at least an entire zone with all its heaters) from my Siemens PLC without manually defining nodes for each variable? Any suggestions or best practices would be greatly appreciated!",Stack Overflow,community,https://stackoverflow.com/questions/79538242/efficiently-reading-structured-data-zones-heaters-from-siemens-plc-in-node-r,1743063863
4f68401f996f,Converting real data type from Siemens PLC (S7-1200) to be displayed in Visual C# Windows Form,"I am trying to read a real value from a Siemens PLC (S7-1200) and display it in Windows Form. I am using the S7.NET library to communicate with the PLC and a TIA Portal V15 to program/Monitor the PLC. I am able to read the particular data block ( DB3.DBD0 ) in the Windows Form from the PLC, it does return a value, but the value is displayed in some other format. For example, if I modify the value in DB3.DBD0 to ""2.22"", it gives me ""1.074665+09"". I would like it to return the same value as in the TIA Portal which is ""2.22"". Below is the code I am using to convert the values. object real0 = Convert.ToSingle(plc.Read(""DB3.DBD0"")); label43.Text = real0.ToString(); If my question is not clear, please let me know, I can try to explain in more detail. Thank you in advance!",Stack Overflow,community,https://stackoverflow.com/questions/60445111/converting-real-data-type-from-siemens-plc-s7-1200-to-be-displayed-in-visual-c,1582862806
75d68368a915,How can I get data from multiple Siemens PLCs into Excel?,"I use Siemens WinCC SCADA system and I need to transfer data from specific addresses in a Siemens PLC into Excel for reporting purposes. Is it worth to try doing it by programming in WinCC scada or are there any other reporting tools? My main requirements are: Easily define PLC and data addresses to read Customize report view in Excel (add logo, adjust formatting etc.) Having data in tabular form and in an Excel chart Price should not be very high By the way, I have a small panel PC on site. This PC has 1 GB RAM and Intel Celeron CPU. The reporting application has to be running in such small PCs.",Stack Overflow,community,https://stackoverflow.com/questions/17493359/how-can-i-get-data-from-multiple-siemens-plcs-into-excel,1373042006
efac852a4026,Read 64bit variables from Siemens PLC,"Good afternoon, I am trying to read variables from a PLC using the nuGet package S7netplus. Until I am using up to 32bit variables, everything is fine I can read and convert the result if needed (here the code i use): private void plcBut_Click(object sender, EventArgs e) { var plc = new Plc(CpuType.S71200, ""192.168.6.1"", 0, 1); plc.Open(); bool DB1bool1 = (bool)plc.Read(""DB1.DBX0.0""); MessageBox.Show(""DB1.DBX0.0: "" + DB1bool1); bool DB1bool2 = (bool)plc.Read(""DB1.DBX0.1""); MessageBox.Show(""DB1.DBX0.1: "" + DB1bool2); var DB1int = (ushort)plc.Read(""DB1.DBW2.0""); MessageBox.Show(""DB1.DBW2.0: "" + DB1int); var DB1dint = (uint)plc.Read(""DB1.DBD4.0""); MessageBox.Show(""DB1.DBD4.0: "" + DB1dint); var DB1word =(ushort)plc.Read(""DB1.DBW8.0""); MessageBox.Show(""DB1.DBW8.0: "" + DB1word); var DB1dword = (uint)plc.Read(""DB1.DBD10.0""); MessageBox.Show(""DB1.DBD10.0: "" + DB1dword); var DB1real = ((uint)plc.Read(""DB1.DBD14.0"")).ConvertToDouble(); MessageBox.Show(""DB1.DBD14.0: "" + DB1real); var DB1lreal = ((uint)plc.Read(""DB1.DBD18.0"")).ConvertToDouble(); MessageBox.Show(""DB1.DBD18.0: "" + DB1lreal); this.Close(); } But when it comes to use 64bit variables such as LReal (long real), the .ConvertToDouble(); is not working right and returns a wrong value. The only case when I can read correctly the 64bit value is when I write it myself in the PLC like this (the LReal is DBD18): private void button5_Click(object sender, EventArgs e) { var plc = new Plc(CpuType.S71200, ""192.168.6.1"", 0, 1); plc.Open(); bool val = true; bool val2 = true; short val3 = 25; short val4 = 2500; short val5 = 123; double val6 = 123456; double val7 = 5.5; double val8 = 8.88; plc.Write(""DB1.DBX0.0"", val); plc.Write(""DB1.DBX0.1"", val2); plc.Write(""DB1.DBW2.0"", val3.ConvertToUshort()); plc.Write(""DB1.DBD4.0"", val4.ConvertToUshort()); plc.Write(""DB1.DBW8.0"", val5.ConvertToUshort()); plc.Write(""DB1.DBD10.0"", val6.ConvertToUInt()); plc.Write(""DB1.DBD14.0"", val7.ConvertToUInt()); plc.Write(""DB1.DBD18.0"", val8.ConvertToUInt()); } Any help is appreciated on how i could handle this conversion from 64bit PLC variables to c# with s7.net Thanks, regards.",Stack Overflow,community,https://stackoverflow.com/questions/41428755/read-64bit-variables-from-siemens-plc,1483367741
7f85961a7d28,Pass data from Siemens s7 1200 PLC to PHP script,"Currently I'm working on project with PLC's. I have Siemens s7 1200 PLC and I would like to pass data into another website. For example I would like to count units and send/record on database. I know I can have website on PLC and remotely open that website from PC, It works. But my question is: Is it possible to have something like html form and log on to another server FROM PLC and pass parameters via GET into PHP script? Basically I need to find a way to execute html link from PLC. [ I don't need code but just ideas if possible? ]",Stack Overflow,community,https://stackoverflow.com/questions/40716810/pass-data-from-siemens-s7-1200-plc-to-php-script,1479720716
19a597e1f53f,Communication between JADE agents AND siemens S7 1200 PLC,"i would like to learn how I can make my agents communicate with a PLC(siemens S7 1200). Basically the agents are created in JADE and make a decision kind of a true and false decision which they are to send the PLC. If its true the PLC is activated or otherwise. I have heard of the concept of using simple object access protocol, but not familiar with it (if anyone knows how to use that they can help me with a sample program or means of linking my programs). To complete this by 08 April 2013",Stack Overflow,community,https://stackoverflow.com/questions/15838327/communication-between-jade-agents-and-siemens-s7-1200-plc,1365177324
ec87437e66f7,Siemens PLC WebAPI: Ping works but device connection fails,"I want to try running a web server in a PLC. This video ( https://www.youtube.com/watch?v=7sWIjMxyXHo ) explains SIMATIC WebAPI, but I have an issue: I can’t connect to the device, even though I can ping it. First, I created a new instance using IP 192.168.1.160 . When I tried to ping it, I immediately got a Request Timed Out error, so I reconfigured my network adapter. . after that, im able to ping the IP 192.168.1.160 . But when i try to download to the device in TIA portal app, I cannot even connect to the PLC, and I got this message Do you have any suggestions or solutions on how to fix this?",Stack Overflow,community,https://stackoverflow.com/questions/79777891/siemens-plc-webapi-ping-works-but-device-connection-fails,1759134615
0e6ae452b231,C# TCP Connection to Siemens S7 PLC - Network Newbie,"I want to establish a two-way communication setup between a PC and a s7-PLC. So far I've been successful setting this up one-way with the use of an open source driver found here: https://github.com/killnine/s7netplus This driver allows me to tell the PC to fetch data from the PLC, and also write data. But the problem is I want to setup an onChanged event for specific PLC data, and the only way to currenly acheive that is to frequency poll the PLC's data until I notice it has changed. I would like it to be more interupt driven, so the PLC sends a signal to the PC asychronously when its data has changed, allowing a faster response, and less network traffic. So I found Siemens Open Communication Wizard, to basically configure a connection on the PLC side that can be referenced in the PLC code. I have setup the connection so the PLC is passive and looking for Port 2000: Now on my c# side, how would I establish connection, just using a socket? // open the channel _mSocket = new Socket(AddressFamily.InterNetwork, SocketType.Stream, ProtocolType.Tcp); _mSocket.SetSocketOption(SocketOptionLevel.Socket, SocketOptionName.ReceiveTimeout, 1000); _mSocket.SetSocketOption(SocketOptionLevel.Socket, SocketOptionName.SendTimeout, 1000); IPEndPoint server = new IPEndPoint(IPAddress.Parse(IP), 2000); _mSocket.Connect(server); I'm really new to netowrking. If the PC is the active partner and I establish connection, I want to asychronously be able to accept data from the PLC, if I setup a socket.BeginRecieve() somewhere, can I still actively commuincate over the socket from PC->PLC or would it be stuck waiting in the BeginRecieve?",Stack Overflow,community,https://stackoverflow.com/questions/29032547/c-tcp-connection-to-siemens-s7-plc-network-newbie,1426250573
949c23a9af14,SIEMENS PLC S7 1200 TOF issue,"Let's say I have a Boolean input which can switch its state automatically. Swichting from 0 to 1 and from 1 to 0 sets a cycle. To determine if that cycle is valid, the cycle time must be at least 10 seconds. I can determine if one semicicle is invalid, but I can't figure out how could to be able to determine at the end of the cycle if it has been invalid. This is what I have:",Stack Overflow,community,https://stackoverflow.com/questions/35683576/siemens-plc-s7-1200-tof-issue,1456668908
