id,title,text,source,source_type,url,date
ada4bc3f882a,Accenture to Strengthen Capabilities for Software and Automation Solutions from Siemens Digital Industries with Acquisition of Industries eXcellence Group - Accenture,Accenture to Strengthen Capabilities for Software and Automation Solutions from Siemens Digital Industries with Acquisition of Industries eXcellence Group Accenture,Accenture,news,https://news.google.com/rss/articles/CBMioAJBVV95cUxORm9lR2lqcHdYeUFtODhpd0ZDcUhnRzJVLXNOMm4yaTRBdVdyRm9UQmlJRklIZTh1MUVOWHozNkRPc20yczI3X2plSy1vQXgtUnQ3NXdrX1o4bjVaWlJxVFU1Z1pkaGxrbzNaT1pQb0wwbnF3aDkzMDJqT0lndnExTWVlSGVpcFBnLW5DS3BYdzVfM1l2ZVRWWkcyME5OVXNsLWtHa2pkNTZSSHRVZ2RNTWZtTXBrR19OYzQ4TWp3elVPUll4dU16QUJIb1BkNWFrT0xpazNXeEYyN1c1NjJ1Q0FwSHJCdm5oTHBhQ2E1ZVAyMWwtQTc1cGxubHRPdlhFNVJfcWgxc3N4Y0RmS2dyU0t4WkN0SmR2UTJ6SmVwWGg?oc=5,"Wed, 17 Jun 2026 06:35:57 GMT"
f46dac0db574,"Siemens Energy weighs spin-off of 'Transformation of Industry' unit, Manager Magazin reports - Reuters","Siemens Energy weighs spin-off of 'Transformation of Industry' unit, Manager Magazin reports Reuters",Reuters,news,https://news.google.com/rss/articles/CBMivAFBVV95cUxNVGdQUGJRZkZXelRPSjVLcG56SGJzbHY3VXl0R2pBcDl4aGQ1dC1ac3d5WkpPZFdNZExvWlZUaC1JRE0xWUZ3aTFVMjVta0R2dUh0MnZlMERxMnhsZjFSMGdBSXExN2V0Z19PMHdEcFRwcXBleU1XNVBVU2NVYmplZTZwOEdDU2labEFoc2hhMlpGdHdGR2RNdndJY1Qxbm1YMEZsYU9yLXo2eG9ZaENpajY5TmV3QmhZMWp4SQ?oc=5,"Thu, 18 Jun 2026 10:27:57 GMT"
a773e50f861e,Hologic wins mammography patent infringement case against Siemens Healthineers - Radiology Business,Hologic wins mammography patent infringement case against Siemens Healthineers Radiology Business,Radiology Business,news,https://news.google.com/rss/articles/CBMi4gFBVV95cUxOSHE1c2pTc0dhUFAxbHZ4dTBJNnhfRVg1TjN0ZHlqbnBtMUVLSEJwT2c5VWh1YzBUVERiQmVPLVR1VWNvc0hUMjN5bG5kdmJZR3p6dDVtbVRyX3R6MlppVDJNNnBFNHVDcl9udnMybWYxOGRiM2xHSnFfR2s5SDN3aktIWFl6SGVWemcyaTVhejBqa3V0dnFsckFYamY1YVdZLXpycHhEcGxnMXUwcFg0a3FMT0tPNlE1X0stdGI1OTN3ZXR6ZHZTZE5OX0VmLW1IeU8ybGZINnBXLXI3dUJXdktn?oc=5,"Mon, 15 Jun 2026 20:39:18 GMT"
aa84dd4f832f,In a First for Advanced Nuclear: Siemens Energy Turbine Package Advances for Oklo's Aurora-INL - POWER Magazine,In a First for Advanced Nuclear: Siemens Energy Turbine Package Advances for Oklo's Aurora-INL POWER Magazine,POWER Magazine,news,https://news.google.com/rss/articles/CBMiugFBVV95cUxOQmREVXlrY3M2R3hVR0pMaUVkVHM0S05NQ2VkaE1leGY0UWZaOHEtOGVaQ2ZnOVpfeGxiZ2JOanFVeHcwTUpMb0RBYk1vejRYLTJ2NmswdExTWHpycm5ZN2JpOHgwbUc2MUlnNmNSTEs4WGFPWkoxNTJMQXdiaFVINlozLVVhV2phV213dnY0VUZiOEhOR3Q2RFlja2h5blcyRXBQRnduSDNCaURLQkI4MHJULU9EZ0s4VUE?oc=5,"Thu, 18 Jun 2026 18:51:24 GMT"
9e61a45e9e6a,Jim Cramer Calls Siemens Partnership With Xometry a “Major Endorsement” - Yahoo Finance,Jim Cramer Calls Siemens Partnership With Xometry a “Major Endorsement” Yahoo Finance,Yahoo Finance,news,https://news.google.com/rss/articles/CBMiowFBVV95cUxNOWRlVndudjRwWS1YekdKM3dZZDJGWWEtMVljV2pwcnozb0dDX1FUQUJIVU9FWW0ydG5WazNNdC1ra3F6NTRva1JpbjhNbEdVb3dUT1hVNzM1NWlWVzNuWTBJYURfSnJndk5lVjRCT3hDbFd3eVgxbXNHdEZENUhlTFZIajN1TExDYlJzbkdoYk9LY3R4c2lWN21BZXFCVWpuSmFV?oc=5,"Fri, 19 Jun 2026 13:35:24 GMT"
58d251798f3a,Siemens Energy to build 2 GW converter platform with German shipyard for the first time - renewableenergymagazine.com,Siemens Energy to build 2 GW converter platform with German shipyard for the first time renewableenergymagazine.com,renewableenergymagazine.com,news,https://news.google.com/rss/articles/CBMilwFBVV95cUxORFp2QVY3Q0JJX0l1dHFCV3M4R29kWnVfM3NXNEhucERyZDZjNlR3ekpjREdQYWVtamVkNmhha09iR3pJcDFiMm4yLWpsYWdyRUp4TzVGdmJ4SDNsX2UyVFJ0MC1tSXNiTXk1eXdmSl9MOXZrbGluWk1VcDN4UWZUSTlrY3BsU0pPSnFhNFBkNXB4VlE4b1RF?oc=5,"Wed, 17 Jun 2026 13:19:50 GMT"
f1eca7c43e5f,Siemens Energy weighs spinoff of industrial turbines unit - report (SMEGF:OTCMKTS) - Seeking Alpha,Siemens Energy weighs spinoff of industrial turbines unit - report (SMEGF:OTCMKTS) Seeking Alpha,Seeking Alpha,news,https://news.google.com/rss/articles/CBMipwFBVV95cUxQZjF2cU96LTZCNTlmQ1FVNUVwcXhtaFNZcXpoTExnb3lQUGZ3RHp2M2dGeDdTNDZuTXI0QjZUZlZNa0thZUUxeUZzUGNsSE40VEtSY3lVNDcwSkNUdWVPRFEtN29pOUVzMmw0by1sSVpOaGpHZ24wUmcxc0hfby1ralZ5ZGowRUxIM0t6dFhhTnNuTHdEOGlaNUE5V3FUc0FxbWVnZi1hVQ?oc=5,"Thu, 18 Jun 2026 16:56:32 GMT"
557fd500f05b,Siemens Energy reportedly considers spinning off industrial division - Investing.com,Siemens Energy reportedly considers spinning off industrial division Investing.com,Investing.com,news,https://news.google.com/rss/articles/CBMiygFBVV95cUxPVlF1dzI1R1pjSzFrdXRGRThGTFFSZ1Y2eWhCeC10RDEycFM0ekE1d0laYnczVDFjdnc5YUNJWko2U3BUSTFtd1p3Q0ZjNDlMVFU4SU1fRUY3blB1b2xyenJoM3NqZWgtU01wczNkc0pvZU1CeTJsWUVFcTh1Z1Bpb1c5b0l5V3VqTTE3dVh2bUhiLTd3X0JfRkszZHlLWHV6TUxlcEN0V2VuMTdWTUhpUlVCb2prTG0ta3NhNXYwZVBYRVZIT2VVdUFn?oc=5,"Fri, 19 Jun 2026 01:03:29 GMT"
428b51a8d9ed,Siemens Sees Industrial App Store Sales Doubling in Tech Push - Bloomberg.com,Siemens Sees Industrial App Store Sales Doubling in Tech Push Bloomberg.com,Bloomberg.com,news,https://news.google.com/rss/articles/CBMiuwFBVV95cUxOTmtaVnlhSkd0QTE3LW1SQ1FtS1NWWUlIWDFuY2RKSERwU0JyT2dDNkQ3Zl9kOUJtWUF5U3NHYUFXUXVyQk95cjUzSVBNckl1ajFHaDBWUGlFa1c1RHhJWlJvWGhFRHcwRWE5Q1AzdGVIN2ZReGJQWDlZQnVON3FaUGo5NVZzZWJiM3Y0MEdvMDBYaEo3XzNQTVZuT1BTbWdFUEVIRWZnLThyczBUR0FYM0pKSGlERllmRWNB?oc=5,"Fri, 19 Jun 2026 08:50:01 GMT"
be2309927550,"Siemens Energy considering spin-off of 17,000 employee unit - EnergyWatch","Siemens Energy considering spin-off of 17,000 employee unit EnergyWatch",EnergyWatch,news,https://news.google.com/rss/articles/CBMicEFVX3lxTE1jTkRXRDA4RHhzVGFmVDk0T2RpRWUxdkVfTTdtZDZRcGxDTkdESXBmQXlpR2FVMzlUUnN5QVU2QVFMT25RWHl0UFU4ZFl2azRtUEswY2pNQkJsbDRiV2EzcFQ0MTVqN1BRVndhNFp6ckI?oc=5,"Fri, 19 Jun 2026 06:26:29 GMT"
125789f7bff2,Siemens and Arts et Métiers sign strategic partnership to promote industrial innovation in France and Europe - WebWire,Siemens and Arts et Métiers sign strategic partnership to promote industrial innovation in France and Europe WebWire,WebWire,news,https://news.google.com/rss/articles/CBMiYEFVX3lxTE5nRkk0MUM4WEExMWppUmRPOTg0MjVwNENBbmxDYW1zZV8wREhnSEFjWUJmaUNyUkMweVFudFpSTUJGUUZDaEtLMjJaVG05bjBTX1hkUkt3M1J1UTdMY2N0Rg?oc=5,"Fri, 19 Jun 2026 13:16:18 GMT"
6e46df37bd9d,Siemens Tech Summit 2026 Accelerates Indonesia's Digital and Green Transformation - Siemens,Siemens Tech Summit 2026 Accelerates Indonesia's Digital and Green Transformation Siemens,Siemens,news,https://news.google.com/rss/articles/CBMipgFBVV95cUxQTTN0R1c1M0xsRlpUbHQ5aGRIUFJrWlZHVHZyLTJra09mZ3FlZWFkWnhhenFYcDBUVU1qSVh3WkVUczd6Q3ZPRGdLNW1JOGswVVBxT19EcFROODhrXzR1U0NHOG5MejJCa3RNMUR2ZmMxTHVWZGdMVXhiaFVWQmx3RlppNVVrMjNtVVM1OXJrMGxFd0NpZFhDaHowOHhyUER4cHFwSl9n?oc=5,"Fri, 19 Jun 2026 01:58:35 GMT"
624edaded7c1,Siemens opens industrial software to startups - Electronics Weekly,Siemens opens industrial software to startups Electronics Weekly,Electronics Weekly,news,https://news.google.com/rss/articles/CBMipAFBVV95cUxNbVE3ek95YURnSkxIS05jVkVtd0p3T1NPaFY0Nk1IOUx0S1kxSENGeUFJU2lfVXNsQ2ZoME1XQ0U3TkJZai1KR1VRVlJVZldGTmlhaGRmVHY3RmhqUXBuNm5IdFpOSUN4dHJoOGc2dTJqaEJrOVNxeTRZQ0k1SndRMWVtbDFhQUxxSmxoaWZobkpkVnFxcEtTXzRwd0tzclFHcnNEXw?oc=5,"Fri, 19 Jun 2026 11:07:28 GMT"
dcea763844c1,"Hologic earns patent battle victory over Siemens Heatlhineers, mandates mammography system recall - MassDevice","Hologic earns patent battle victory over Siemens Heatlhineers, mandates mammography system recall MassDevice",MassDevice,news,https://news.google.com/rss/articles/CBMiiwFBVV95cUxNUE9RSXVucEN0VWQ4OFY3UXE1RUxmbHQ1dW4tdjg1eFBDZkRqQnRBMmlOczdpQXFtLU1JVGNZTXJVVl9TRXFFOXpFUUY3Z1J1OEFwdkF6NW9weFh5LU9EMkpWSVRXOWRydEpnTTlHMkZoSHlfMWJWMnV2T0M3NFppT2FaMml5dGNlZlpB?oc=5,"Tue, 16 Jun 2026 23:36:53 GMT"
6985c7b82190,Siemens And Arts Et Métiers Sign Strategic Partnership - TradingView,Siemens And Arts Et Métiers Sign Strategic Partnership TradingView,TradingView,news,https://news.google.com/rss/articles/CBMiwgFBVV95cUxNdkhGSDdadjRTQlFzcGNGb0gzdllobkdKWmhYWnZJUmUyLWhIWHBKRnVvYnNwaVNZU0NRX2p3MUIzUV91ZFBtd2diaUFaaHFjOU1DQnZyby1CSk9qMWl0Z05aNmllbWNBeDM4bUFWZ3V4Zi1LUGJyTk5oaVd2U0JEWUZjdnZIdVUtcWdYc0tmcHNGUHNnTXlHUVRPX3VsaFhOQlBnS19OenFhVWlDOGFTb3RScTljdFhGaEVHcW50OG9hZw?oc=5,"Fri, 19 Jun 2026 12:02:58 GMT"
2ffcbd3d7ada,Siemens Unlocks Industrial Software to Strengthen European Start-ups - Industrial Engineering News Europe,Siemens Unlocks Industrial Software to Strengthen European Start-ups Industrial Engineering News Europe,Industrial Engineering News Europe,news,https://news.google.com/rss/articles/CBMinAFBVV95cUxPYmhrTFpDR19pRHFPdXdlbThQZFl6aTI0ei1Sb0VZUFNSSlA1STg0ZFFFWmY5YWl5X0lrMUhiZWhsMnRFdkxmSWI1OGRkYUpDb0htMHRNMXdOTy1BOXhkNnBYSXpGVDhJMFZCNEZMV0lpajI3UE03aWVBdDc1QkhoUWUtMGFzQzhqZ2dxOFBkbll2Y1otMkdFc3AwSW8?oc=5,"Fri, 19 Jun 2026 06:39:42 GMT"
003ae33a048f,Magazine: Siemens Energy Weighs Spin-off of Major Business Unit - marketscreener.com,Magazine: Siemens Energy Weighs Spin-off of Major Business Unit marketscreener.com,marketscreener.com,news,https://news.google.com/rss/articles/CBMitgFBVV95cUxQMmF5MUF3NFVEQzRZUEVtS1BfdU42dlk0N2lpSW5QWHFqYWk3TTVhYURFbVByZldiWnFyTFpCMGstNnRFYTRtUXFSSUdxOXVoYVhYM2NqbU1qaGNXbGhKa2pqQWdJTjI4TDBWNUZEcUNYVlN1OHJpWXdsb0J1LXkzUm54RlNwOHY4YXAyNDVrRzFvRW4zN3V6RE9rU2RPUG1CMlJVUkhuV3VCdzV6ZUR1S2VuMkFsdw?oc=5,"Thu, 18 Jun 2026 14:50:29 GMT"
a453616623d2,SBA approves Siemens Financial Services as 7(a) lender - Siemens,SBA approves Siemens Financial Services as 7(a) lender Siemens,Siemens,news,https://news.google.com/rss/articles/CBMiiAFBVV95cUxORWd3V3ZMaVVLNkVnY1VkWGhidWRsc0RMNEo1clZuclkxb3U4LWJpN0d5bzJKTGRCODZnOC1ua0VxWldWSVc2d01JZXJYTnVfLWFidVkxeUJBTjk1UzlOQURyOGY4eTM2UTR1X01pbWdnQkp0bWl2bWNiQWduallPMy1KVGFXUVl3?oc=5,"Wed, 17 Jun 2026 12:55:52 GMT"
499f86f412ee,Siemens expands accessibility to Software-Defined Automation with Simatic AX - Siemens press,Siemens expands accessibility to Software-Defined Automation with Simatic AX Siemens press,Siemens press,news,https://news.google.com/rss/articles/CBMiuAFBVV95cUxNWDFNem5YUzBmYnZiTDlTRW5YTDV2cGdVZ29zLXhxTUV6NDN1VU5vRXk5Q0ljemM0SGFIQlB6dGxUUlpNVmJKbnFPWkNDcGRpTVdMVjR3cGUwZmh3bzR5UndCQkNkR1c3bGFTaXN6Z2syc3hxc1o5U241b1A2LTRHWU80bFV1X0t6aFhRWEJGYTRCTk52UlRuTVlXS1FPZnJCOWVrNmVGeVctMjdBZk1HUmcwRFF0ODVM?oc=5,"Thu, 18 Jun 2026 13:16:30 GMT"
d9287b696648,Siemens takes AI for the physical world to the next level with two new Eigen Engineering Agent capabilities - Siemens press,Siemens takes AI for the physical world to the next level with two new Eigen Engineering Agent capabilities Siemens press,Siemens press,news,https://news.google.com/rss/articles/CBMiwAFBVV95cUxQRVRWdGtEbmpsclR6VkpBWjlPM09GNE5iSmw3TXdVQXoweU42Nm9GTjYzQzhOU1UxTWgxWDNuUkh3Y1FnWFVEazlITkRORzFUdlIwUll6NG10UHRXLUc0SjM1Z09JaTAtTUlacWFwS1hnYWF6ZTlidGd3TDBGX0I0c3NibDVXSUw2Q1dmdGdkOVgwVFlqUjVmcXdzR1poRlNma2NVQkk1X29zazhqNG15aTFULUdJTWk1dmFOUjhMV1A?oc=5,"Wed, 17 Jun 2026 07:28:29 GMT"
5ca414f930d2,"Queensland manufacturing expansion, boosting jobs & exports - Siemens","Queensland manufacturing expansion, boosting jobs & exports Siemens",Siemens,news,https://news.google.com/rss/articles/CBMigAFBVV95cUxNRHFSVlJ2RDZ4eXUxeFVsMGdRMVFia1dZQzlPcHVHd0w0OXN0ZXhGUnBRM3pTTDdrYWRteHhXUzh0SjJDbWp2RFdCN3dhS2NMUVgwRjdubzRQTV96SF9tMUIyWko3dFVJbDZMWDFxYnBBaDlWd0xRMmk3N1VxNXNZZQ?oc=5,"Tue, 16 Jun 2026 16:51:32 GMT"
a91e616425b9,How industrial AI is reshaping automation engineering - Siemens,How industrial AI is reshaping automation engineering Siemens,Siemens,news,https://news.google.com/rss/articles/CBMimwFBVV95cUxOVjZaTDVnODdUWHlnR21YR2QzWmxUcE5PRDdfNUp4Z0xKSEJ1dEZyaDdPSHhHTVNfWGRzUFVsZFBoNFU1Y0VYc3VYMWxDR25WQVdQYUo5ZVV5SmMzZUYtMnRmQTkxZjc3TFJ1aVhRaUFwOXNiV3JETFJoSW5PU01meDhYOFZUZHRMZzRaQXB5NDY3SjRHNjl1dXlzRQ?oc=5,"Thu, 18 Jun 2026 08:42:34 GMT"
544d0c4f697b,SBA Approves Siemens Financial Services as 7(a) Lender - MonitorDaily,SBA Approves Siemens Financial Services as 7(a) Lender MonitorDaily,MonitorDaily,news,https://news.google.com/rss/articles/CBMiigFBVV95cUxNdnk3cUR2VUU0anhMeWFBUzJnd05yN1B2aDQwUTVveFdWNjJyT0FnaVczblVkXzI3cTk0R1BHRXRwdlpDemdwdXlXdVlVbW9tcDFfcmpjSzNnMWFxRGdNdkxhdWtUNDZmR282NEhJcUxfYWNfWVZwTXVVR292aWNyLVRnT0E1MUVuRVE?oc=5,"Thu, 18 Jun 2026 06:30:39 GMT"
1d237ec7c34a,"Rail News - Rail supplier news from Hitachi Rail, Siemens Mobility and ProVision. For Railroad Career Professionals - Progressive Railroading","Rail News - Rail supplier news from Hitachi Rail, Siemens Mobility and ProVision. For Railroad Career Professionals Progressive Railroading",Progressive Railroading,news,https://news.google.com/rss/articles/CBMi0wFBVV95cUxQUFJPcnE0SVlmZGRuSlZiQ2VLY1pHY25LQllIYXl4d1RoeGpvQTFGRjFKSDRKd1lIUUxCanRVeWd1VEJMa3lNUEpXVS1QSjQ3a3V4ZkNHbjRxTGdQUl9McDlTUkh1STJaZmpBQlBQWlRuN0xhZGhCbEhmRUk5VnBmS2hkYzEtR0prRTM1bnc3NURwRnZxM2lMdWMzS2FhWi1hYW1xSFkteTZoS3UzLXVrV2tMY1R6VlB1Q2tRaWV4N1VWeGZQc0dXTlBUV1NWU21keXZr?oc=5,"Wed, 17 Jun 2026 15:54:34 GMT"
0fc025bc62c3,Siemens Energy Weighs Spinning Off Its Industrial Turbines Unit - Finimize,Siemens Energy Weighs Spinning Off Its Industrial Turbines Unit Finimize,Finimize,news,https://news.google.com/rss/articles/CBMilwFBVV95cUxNLWJCeWNuQzlLanlpUm15bkR2bXA2MkVDNmVSR2pvYVhBWDZkcC1McU5qZGFoLThOMTgxclQ4ejdIbGdaeTBsU1I0dGxZV0p5UEc5N3ByY050UWp1aWtxbTlIS1FWREhZSDlEbHE4S3RkcHpRR280M0ZLYi1OMU5vUzYxTzBzRUkzMi1sWWlYUDlzNWhydDdz?oc=5,"Thu, 18 Jun 2026 11:39:04 GMT"
071e95769d48,"50Hertz awards Siemens Energy, NSORe offshore converter contract - Reuters","50Hertz awards Siemens Energy, NSORe offshore converter contract Reuters",Reuters,news,https://news.google.com/rss/articles/CBMitgFBVV95cUxPU080bGthZDFuQjd0b0tqWWtOV0ZSNHRhMmhhaHlJb0pPN2VIbmtRUVFwZEJRdUdSWVh6SDE1VDhENlNBNzlZM216enU2RXhRQmVEMlAzY3Q1T1NoeEtOYmNxS0c4XzNncnUyQktIdTBmdUpkMERWbXM5dUhyS0VKSTRpNW13QnRqVnpwQjZuN25LNEs5SkVMNUNHY0RMY3FOTjNmU1NxbTdrVG13SlpwNkRjdXpaZw?oc=5,"Wed, 17 Jun 2026 09:31:44 GMT"
4f528d9166c4,Knorr-Bremse to Supply Braking & Boarding Systems for Siemens’ Vectouro Platform - Railway-News,Knorr-Bremse to Supply Braking & Boarding Systems for Siemens’ Vectouro Platform Railway-News,Railway-News,news,https://news.google.com/rss/articles/CBMipgFBVV95cUxOWDVodTVFOVcySl93Q19GRTNGZHBDLWdIOHJVSzB4SkduazM5bWt1djBjaUc2c05HU014WU1OVldtNjlRRHU0VTRBTU1NZ3VxVVRlNG5tZldDYlduWV9qTVB4V0pvNUU3cmlXT0tfV3lvSjNUendTb1ljWFdYYTg3R3BSaFhJdlJISlAtNWxRRXZxOGRTYUlvUGg1VWVXOE12aVRjY2ln?oc=5,"Fri, 19 Jun 2026 09:56:15 GMT"
82b811f79c19,Knorr-Bremse will equip Siemens Mobility’s new Vectouro series - Railway PRO,Knorr-Bremse will equip Siemens Mobility’s new Vectouro series Railway PRO,Railway PRO,news,https://news.google.com/rss/articles/CBMilwFBVV95cUxNc25fSC1rOWcyWWVzWi12bHowUXp0Q05WR185TUljY1lSRjRGaGpiT2toNFFBaklfel9HQ1Jna19FQVpHOVBTN3JpTHc1YzBvV0JuV1hrdjdPQkczUFQzVHFOc3Blc0hVN24xUzNjamlaYW1yOWdLYmFIYlM0UEhYMjBJendPdmVOaXgtblhwVENXdnZ3cWF3?oc=5,"Fri, 19 Jun 2026 08:52:34 GMT"
208ce5a57fa8,Siemens Debuts Intelligence Center X at Realize Live Americas - Advanced Manufacturing,Siemens Debuts Intelligence Center X at Realize Live Americas Advanced Manufacturing,Advanced Manufacturing,news,https://news.google.com/rss/articles/CBMi8AFBVV95cUxPck50cm1rak1ITnI2eXE3RWRSQUxqUzhSYUxQWXk2bjkzbWhSLTY0VUVfeEkzZXJ1MUtpSzQ3VEZIb3Mzb1RSc29jYUN5Rmp0VGlBM011VkdPdXY1VUxYb0dwQnlkbmRfRzNsM2J3Nk1FeEZLZFRqeF95S09nM1lNcVZOdHF3Zm5PNjBycFRyZ0gxN253Zm4wQ2RGR1MtWVNzUUhJcEF1eE10OVZxNkhpeGFkeGMtRjFVQ2NRNWNZV20xYkZHbnhRc1RrZG5wc2cwNlU2VEVqSHdSTkR2SGZheXRYU0Z0RzZTSnd1YW1ONzE?oc=5,"Thu, 18 Jun 2026 15:30:00 GMT"
1f20c1884790,Siemens links industrial edge data to Databricks AI - Engineering.com,Siemens links industrial edge data to Databricks AI Engineering.com,Engineering.com,news,https://news.google.com/rss/articles/CBMihwFBVV95cUxQVFBQeWJOVnZaVEtabzBNaFNVazJNVWM1c0tCSFRnRkRhbHJUV1VVODYwcVFRbTk3N1pYcDJBbjJkX2RQTjdlNHBxRzdmaWE2ZTZjR0VoOWIyQjQ4Ri12b0Y1Uk02bU5VQkhjLVpONzR5ckJTM29RbUJJZVd1MjRDNUs0NEZvTDg?oc=5,"Wed, 17 Jun 2026 15:57:40 GMT"
7b6262ac42a9,Siemens expands Startup Programme to provide industrial software access in Europe - New Electronics,Siemens expands Startup Programme to provide industrial software access in Europe New Electronics,New Electronics,news,https://news.google.com/rss/articles/CBMixgFBVV95cUxOZ1NsRnMwOFF1SURoWThJZGZMWTJKQkYxNVpyNzFENHgxTFEyMFg4STV1MmpDcUY4ZEllekV1TDdiM0pLTDNnMGFhNkNkal92OURfakNQZi1BTnludjkxbDFrWGQ5RS1vX3VNSjA5dmtMNnZRTURQVFpUMHlLUXVjWkliNnFuY1N5U08tT3JpclJvZ3NPNXpmWWtJWWRlQjVMYlR4NzNDMXZoQTZFc1FsYXhiVGh4SDRvTmxDSmpCOFJsSDNNdkE?oc=5,"Fri, 19 Jun 2026 09:56:32 GMT"
14f6874d639a,Siemens partners with Databricks and FFT to turn production data into scalable AI-driven insights - PR Newswire,Siemens partners with Databricks and FFT to turn production data into scalable AI-driven insights PR Newswire,PR Newswire,news,https://news.google.com/rss/articles/CBMi6AFBVV95cUxNMnBGVUYyWjh5ZDJIQzZHc1ZWRU5iQXJycW9TZ0tpbW15ZkI5S3lXUDZWc2h1VWREUHRVeVRCWV8wMDJLTkFHSFZBS0Z2X2hZS21hcmFXZ3JoZkM0UWgzYjZFdWNCMnVDTzhkeG1LaHhTZWlfeFI0WjJ0Y3FxdVg5NnFSSW5TTEZRY2RFbFhqc1QyR2VBY0xxcF9BcDdESnI1MVdKcy1WRXdHRlNjdVZkRG94MGFkTFNXbXFKc3RLWDJnenFLa0ptdFlmNzlXVzhMMW5NQlRHMXZmZ2tZTUM0dVZDTG05emRO?oc=5,"Tue, 16 Jun 2026 15:00:00 GMT"
94a1804f95a8,Siemens Expands Eigen Engineering Agent Capabilities - ARCweb.com,Siemens Expands Eigen Engineering Agent Capabilities ARCweb.com,ARCweb.com,news,https://news.google.com/rss/articles/CBMihwFBVV95cUxNTDBoN3F5VGpuY0l4Sl8yQmU2ekUtb3ZEaXNURU11akxVWFkzbFNjbHVod3JOZ3NJbklNc2RQNXFqZ09FalMtbWdwcTdQUHNJdnBHZnBZYTItVHczX0ZsNDhhT1VDTk91blE3R19tcG1tQzJwWnppSkJkd25xZkVhWHBFNy1ucEk?oc=5,"Wed, 17 Jun 2026 12:00:00 GMT"
59f5830f8329,Siemens powers the next phase of industrial AI with Intelligence Center X - Siemens,Siemens powers the next phase of industrial AI with Intelligence Center X Siemens,Siemens,news,https://news.google.com/rss/articles/CBMibkFVX3lxTFBjeWx5WkppZ25iOWo3U0t4ODM4SjJqalNMcVAzSFF0WVFBczBGTXZIUkZCbG81SmFrQ195a2xEVlMwUGpJREZUYVRsX1E3REx5TThyRXJydjdBTGQzdXZWaHFvYzNoTm9hVzZvSW5R?oc=5,"Mon, 01 Jun 2026 07:00:00 GMT"
9b42c91a680d,"Deutsche Bank keeps Siemens Energy at 'Buy', target €200 - marketscreener.com","Deutsche Bank keeps Siemens Energy at 'Buy', target €200 marketscreener.com",marketscreener.com,news,https://news.google.com/rss/articles/CBMirgFBVV95cUxNcU5nVmEtTFNpanVISWtfeFZQTWtMSmRUdU5EMUZZQ3NRU09pUjk5MnJRaUpvbUZTTnFkaG51blNSZTlpT09nMU91S3M3Y3h2c0V5RGM2cGxIaEtpZHFUaGhHMnN0SjlJQXdPVGtKRkthWjRfN2JpMk1mMUVHSVd4WVM5YmtTTkdPNDZPSlJ5Skl5VUhoWXA1YWdkQ0lQX2pPSERhczluWDEyaW8yQXc?oc=5,"Fri, 19 Jun 2026 08:19:31 GMT"
570ab829ece8,SIEMENS ENERGY : Receives a Buy rating from Deutsche Bank - marketscreener.com,SIEMENS ENERGY : Receives a Buy rating from Deutsche Bank marketscreener.com,marketscreener.com,news,https://news.google.com/rss/articles/CBMirAFBVV95cUxNTU1VM21KZkpvTml0ZUQ5TTZXTjJYX2kzWHlDd0g1aFo0OHNMV0NtZXUyNHFSd01PN1RRaURRQXMxME5DcXFYbUJCb2NqUjgxOThTQzZxS3VuaVZ3MXJJbVRRc3VDQW4xZm95LURLd2lyVWczdUNRdjdxVDBNYlVDSXZxRkQ3Sld3YnVpS1VSYU5rTXpXLVNmXzRoN2pqZXdwOW9KUE1TX3dWalVQ?oc=5,"Fri, 19 Jun 2026 08:19:40 GMT"
b21a6a2a3393,"HPE Boosts Networking Gear for AI Clients, Adds Siemens Energy - Bloomberg.com","HPE Boosts Networking Gear for AI Clients, Adds Siemens Energy Bloomberg.com",Bloomberg.com,news,https://news.google.com/rss/articles/CBMisgFBVV95cUxOTUd1TkRFMkJ0Wm9ZQ0kyWllVUUNHUXZJZnhqcWoxX3pfQkE1T2ZuYlpWdVlkWnN2ZnA3WGRrcGRORWNCRlhtNmlWdFhNLXNkc0lIcEpnVXBndUw4cjh1RFV0alNDOUJSYTM5UWxBWDd3LWlNX3BRUjFpb3NiMGU3Q3lIUm1jQ1JHZUFWbnN3OThROTJFWlNYUlYzRndOem81RGZ6NWFWOG12MkpCWVlsX0dB?oc=5,"Tue, 16 Jun 2026 16:30:00 GMT"
10229c87c4aa,Siemens Energy’s Portfolio Review Is Back In Focus - Finimize,Siemens Energy’s Portfolio Review Is Back In Focus Finimize,Finimize,news,https://news.google.com/rss/articles/CBMihAFBVV95cUxNQ2xYOUdCb2NCNEdhTjdwc3BiY3pnUmhqUkxFV3Nvc2E2RkZTSFdZUmx1R3Q4a1VhUWlObjFaaXZMZVE2QllnMjhPellOTU9CQzBvRkJQVnp1d0x0MkJ3MXIzajZITEwyZFlENXBiNllDOUREb21UdGJhSXBzSGhrd2hFRHQ?oc=5,"Fri, 19 Jun 2026 00:04:05 GMT"
413ef041ecf3,Why is Siemens Energy stock surging today? - Investing.com,Why is Siemens Energy stock surging today? Investing.com,Investing.com,news,https://news.google.com/rss/articles/CBMipgFBVV95cUxNYnBBTjRtcTdSUHBWYWZZY1BDODcxRXZJc1h0WlNPRWlmQmJCWHNqdlV2Rk9oWkdLbHY3NkJyckpzbVZtVmFHOFpEWVgta3NMcHZRVHRBa2h0M1l5aGNKc2I2WHI3cjlXV1JDQUF2dmNkTDRscUMxYmEzdFhBUDM4ZEVKWHFuaHRpZTNwZFNIUTVkSHBQRGdVNTRsa1JzVk5IMENqX0t3?oc=5,"Thu, 18 Jun 2026 11:11:18 GMT"
4c6e43f4adc2,Siemens and HighByte partner on industrial data operations to scal ... - Siemens press,Siemens and HighByte partner on industrial data operations to scal ... Siemens press,Siemens press,news,https://news.google.com/rss/articles/CBMiwgFBVV95cUxPRkQxNS1VYVBIQThkNnhMVjF6QkhubXZCT0ZISkVXcmpzYi1EbzZoVGlrTkd6NFRVdk5jdVA1UUROZ1dFakVnUkw5TjU2cFpoTDNSV2NlRXhLUllLNnpjT1VzemUyWXVkUGpSMkxaWmtRTFV6Y3pUUm5uYXFkQVZSZm5mQ1lfRE1PWnQtcTRGN3pNQlBOY0ZRM0lpWER6cC1NV0p4VEJsQ1RETzNBZ0ZWNk9aN3pvRlJGN25Zd0EyZnBYZw?oc=5,"Wed, 03 Jun 2026 07:00:00 GMT"
a71fbfe47e97,Siemens Energy chosen for 2.6GW Taweelah C turbine supply - Yahoo Finance,Siemens Energy chosen for 2.6GW Taweelah C turbine supply Yahoo Finance,Yahoo Finance,news,https://news.google.com/rss/articles/CBMijAFBVV95cUxNTHJmTUJXMm5Fd1pwR3NqSTlDMFZSeTlGV0dMRTNkMUhIdHpyMW04MWVscEdrLTYtTk1pYjBqY2RmazNISWl0Rzc2X2hHUWhJUkVFb1ItUkVXaV9XczhmTG5SbFdRSE8xRXVabF9KNHk2WWwwZ0U4S09ZNnhOU2E0YkNhX2VNazg3WlYtdA?oc=5,"Tue, 16 Jun 2026 13:24:53 GMT"
e39c321e12dd,Siemens taps Jabil to expand electrical equipment manufacturing in Virginia - Siemens,Siemens taps Jabil to expand electrical equipment manufacturing in Virginia Siemens,Siemens,news,https://news.google.com/rss/articles/CBMinAFBVV95cUxNcFFXdkJHQ1pIWWlBNHBjd2xCd1d6T2RDYmlzVHZPM2hLZEs3bXFTUG0ydERZZ2xpMUF5RTZOUTlfeWdxREVZNUtvTThDYnJkSUljM0tEazk0a09FSlRpYU1Ha19MNk4xcmw3VDVzOW1oR180NGY0ZWpkQndVb2hZWEQydkdRZXZ0QUh0NEJxQ1JsMC1YbTBlYTMycE0?oc=5,"Wed, 27 May 2026 07:00:00 GMT"
27d9ebfa703b,Haddy scales AI-enabled adaptative microfactories with Siemens Xcelerator - Siemens,Haddy scales AI-enabled adaptative microfactories with Siemens Xcelerator Siemens,Siemens,news,https://news.google.com/rss/articles/CBMiWEFVX3lxTE0zTWtCYldzTTFLZzA3M18weDN0TG5lYmdYUi1uT3p5U2w4b096Q3luVC1Qal9IQjZyYWlhdG01QjQ3Z1c0TktSQmVhaHlDXzBXc2VRd2VFMWY?oc=5,"Mon, 01 Jun 2026 07:00:00 GMT"
56b1a7366ccc,UCF Alum Helps Siemens Energy Power What Comes Next - University of Central Florida,UCF Alum Helps Siemens Energy Power What Comes Next University of Central Florida,University of Central Florida,news,https://news.google.com/rss/articles/CBMigwFBVV95cUxPS3pRUWMwQ2Y1cGctSFp2RkhwX25KSDd6WEs0SWpyWklzWDVaMlBIN2dYRWtjZWNqRWtPZ0VoQkR0WU5QS3FEWjRkZlZhbzZJNE41TVpUOVFhTzZRZmFQZTUzMS0yXzFRSFoxdjV1ZTB6U0RnbXJodTREcENjQ1p6aXdDbw?oc=5,"Tue, 09 Jun 2026 07:00:00 GMT"
26cee5e04833,"Siemens, HighByte partner on industrial data operations - Evertiq","Siemens, HighByte partner on industrial data operations Evertiq",Evertiq,news,https://news.google.com/rss/articles/CBMilwFBVV95cUxNcDhlakFVWkpYQXlYU2tJSE5vRUlVMWNVbWk5bXRMM0dRSF9uLXN4ZVViQUpWRjBLN3U5SGtQZkI3aUFRUWhVSi1qaUtVLWxJWGVleUJ0djZZeXdlQjN4LUpDQ1ozRTlrOEFQTXAtY1B5SlVWZnNHZTBXUzd0VTI3SlVPdkl5cUlpUHhWeHc2UENVbHlWT3ow?oc=5,"Thu, 18 Jun 2026 11:00:48 GMT"
3dcfbf324cf2,Siemens and partners develop reference architecture purpose-built for NVIDIA AI data centers - Siemens press,Siemens and partners develop reference architecture purpose-built for NVIDIA AI data centers Siemens press,Siemens press,news,https://news.google.com/rss/articles/CBMiyAFBVV95cUxNYUVHYWVJVGR3cXBnQmV6REx1OU9kZGk1dUdSMVduMnBRZi1XdGVEVjVkczdQQkRzUHk5dFQ1dWd2X3o2UWVkN0FlQktpUW5jNzVtODNVUUpvWk1HMTdWVFZMRE1OX2ZXZEs2clA4WXFlcUtnTTdrOEs5bzYwNWxRYmdwaVBXNHlqY1Q3a3F6NlQ4ZjY4YnZHWjNuX1kxUl9iZ3dza0U0UHlSd3hxSFNiMWM0bUhuYXBBLXdlbWd6NHdvYlNIbUh1bQ?oc=5,"Mon, 01 Jun 2026 07:00:00 GMT"
39e1454dcdaf,Siemens Energy wins order for 2 GW North Sea wind converter platform (SMEGF:OTCMKTS) - Seeking Alpha,Siemens Energy wins order for 2 GW North Sea wind converter platform (SMEGF:OTCMKTS) Seeking Alpha,Seeking Alpha,news,https://news.google.com/rss/articles/CBMiqgFBVV95cUxQcWgtNU9EbjM0RGN4YWdFLVQ2S0o1UGdEVVNYZVBLN0V6RmpoV1BTdkE1cFA1RXRROEVrZUw5OEY2Q0JSTE9HN1dZczN0bkJTMm9vWVpOMG5SZzhuN29qTUpoN2R6SUQ5QWhCMXBRTEJuQ180d1pNUTlHUldjUVdGenh0R2Q0cmV3bld5MjdpRG1QTDFoNW5Kb3hOWkhkMzJzUXNid1V4VnVkdw?oc=5,"Wed, 17 Jun 2026 12:48:16 GMT"
4ec58a840554,Accenture to Acquire Industries eXcellence Group to Expand Siemens Digital Industries Software and Automation Capabilities - citybiz,Accenture to Acquire Industries eXcellence Group to Expand Siemens Digital Industries Software and Automation Capabilities citybiz,citybiz,news,https://news.google.com/rss/articles/CBMi8wFBVV95cUxPMkZLRXhNeGdkQTV3TEh6b2FKTGhnaXd2anp2UV9SSzlnbDJzQXBXM0hmQ3BPWEU2M1NpcnoxT1NRVGxBYWk4a0JrX0dqTjJVenpURUhlTll0VERUSkNDaEpkdlZ5clJZWU1uZC0zaUxOamJ2Nm1oQ2FfdHk2ZzUwTVlKOGtyWVBPSjhISmRjS1VSUnZXX2hnR0FxTWo1WTBsT1JtRDFXdERWRzhpQjZjSzRwbE1yUDBaRVBOSkwyczhoc0c5LUdrVldlNmlQdGVMU2lxRXNWRHNTd0paSEV5NTlOakZLRkI0dk5rVW1WcGNKeFE?oc=5,"Wed, 17 Jun 2026 12:04:04 GMT"
10bcb8c46f0e,"Siemens Energy, Neptun Werft and Smulders to Build 50Hertz’s 2 GW North Sea Connector 2 Platform - offshoreWIND.biz","Siemens Energy, Neptun Werft and Smulders to Build 50Hertz’s 2 GW North Sea Connector 2 Platform offshoreWIND.biz",offshoreWIND.biz,news,https://news.google.com/rss/articles/CBMi0AFBVV95cUxObEVuRGVqQ3c3aVdWNUFnRmVaVXNubTBJQWVjcTRqLTZlMG5qRFFCRFdKdGd3LXM3YnRRQXkzRGZmN3hMM29iYzFkX0hhanFWVTBpRDFFQjNwUFY5VmxCOUNQajJBaHpTOGZWQlkzbUhyWHdZYUpwOWRZN3A0MDAyYVBvYnNHcElYOGRTeW5KY0I0emZ6VkJxSkhtWktVYWw2aHRnN2w2V3FQVG9NeG9DV0lLSVZuRkI2SmFoeVZRZ1VVUlFIOGYteHhYYlFsbFRp?oc=5,"Wed, 17 Jun 2026 09:49:09 GMT"
