id,title,text,source,source_type,url,date
47ce9189f8c5,"Siemens in Chicago, IL - Siemens","Siemens in Chicago, IL Siemens",Siemens,news,https://news.google.com/rss/articles/CBMickFVX3lxTE5uaU05c3A3T3BOalBYczJHbW5Hb2FES0h6TnlCQmRTSEdSQ0J2M2JxOEktdzd5WU9rcjJ0TzRHQ3hDODJmV0xmQ1NFWGlsa0QxaWJQMVFZSnljVDNxcmZQdnFpYkpacEJIMmd1THZ4ZF9sZw?oc=5,"Fri, 13 Feb 2026 16:14:14 GMT"
944bd61cd805,Accenture to strengthen capabilities for software and automation solutions from Siemens Digital Industries with acquisition of Industries eXcellence Group - Express Computer,Accenture to strengthen capabilities for software and automation solutions from Siemens Digital Industries with acquisition of Industries eXcellence Group Express Computer,Express Computer,news,https://news.google.com/rss/articles/CBMipAJBVV95cUxOclJGRTExempfN3BaODVGTGZRWmdub0pPdFhoX2pQb1QwbXRQMF9oa3czVG0zMWV2ZWF4QTAtYTljM1RZZTU2M3I3NENSanpMYnQ5VGVJYkl5T3NRWGJfZnFxaDFqb05GNjhJSGZFZ1hZeGFVODk0TVh5NWkzR3FaeFUyc2lPYjJYbl83SjRMeW1RYXBfQ2pKMDVIOEhhQ19zZnNZbU0xQWZqeDNqczVrMENGT0FneGFDSzhHUy1Jam1UWXNJakFLZkVScVlqblFpV0hIV21HUm9STjJZM0NLYXpvUzF6WWZXLXJZemlsNjNkZVhMMFYzUHNFSXNMZ2x6a0RZVS1VWnQ2SUpXa2dLQ3FKWF9HNG9IQkx5N2xIMHhfWXpn?oc=5,"Wed, 17 Jun 2026 18:12:07 GMT"
7603cb93d84a,Automation supports climate research in the UK - Siemens,Automation supports climate research in the UK Siemens,Siemens,news,https://news.google.com/rss/articles/CBMirgFBVV95cUxNSU9lbzBYSm5CSXRDQXgwREpoZTM4V1J6ZXM1Ykc2LUdadmpoNkprcVZMa1NBeGg5UUtHektIN3NvLVJ1V19RcUJ3OXlPX0tyYjJuMGtaS0lsOEFzVXZGNzRrRV8tckdLREdOaTB2TEVudjl6X2J1NEp0MnQtTmVxVGhycllma0xHQldUQjc0RF9YRWM2NjRKN1c2WGEzN0M4TnMyNjNsWkVwRktFTEE?oc=5,"Fri, 13 Feb 2026 20:24:05 GMT"
2dbcf9cd2aec,Qualcomm Brings On‑Premises Industrial AI and Connectivity to a Siemens Factory Model at MWC Barcelona - Qualcomm,Qualcomm Brings On‑Premises Industrial AI and Connectivity to a Siemens Factory Model at MWC Barcelona Qualcomm,Qualcomm,news,https://news.google.com/rss/articles/CBMisAFBVV95cUxNYnZQY09ZbTk1N2lfR2NNTGI5SU5pdWZENndRU3F6Y0R0Uno0WFlqNzB4cjBOeDVvOUZScE12VGRwd1U4Z01QWnRQM1pKWDl2bklWdFZRUzRtUXFFV2FXNHFfT294WXRoQU1heDdua2ZnZlRZdnlDYWJKbHhLdEFudkVfSlRxUkRwV3hDc2xwWTRnbEpFbHd0eGZ2OHk3bm1Hd0k2d0RkN1Y1Wk40Smx6Wg?oc=5,"Sun, 01 Mar 2026 08:00:00 GMT"
ed2e78390a20,Siemens and GlobalFoundries Collaborate to Deploy AI-Driven Manufacturing to Strengthen Global Semiconductor Supply - GlobalFoundries,Siemens and GlobalFoundries Collaborate to Deploy AI-Driven Manufacturing to Strengthen Global Semiconductor Supply GlobalFoundries,GlobalFoundries,news,https://news.google.com/rss/articles/CBMi5wFBVV95cUxPY1VUbE5WUGV1X0tMQTEtUG9ZTDJPTHU4ZURoSkREbnczRGtoeER3ZnVmWHg3ZmdYTzRwNmQzZl9JZURhVk5DZHJVaU91UnVNTVNxbHZ4aEk2ZXA4SnNkZGxRSjQ3WjBnQ2EyY1d5Z1ZlSGRtOVBYQ285OERVVkVQVlhrV3h6cTlncmlfNW9KemdUNVNDRW9PZmlPcm5Wb1pPazhXZVVua1NvX3pOVlB2TDhfQVBiQUwzRnVnUm5fNFdic3lpeVFCVHB6M3ptS0pqZUVNWmlwTGNnQzFmcXBaOUlQckVMM1k?oc=5,"Thu, 11 Dec 2025 08:00:00 GMT"
48316978e864,Siemens acquires Canopus AI to bring AI-based metrology to semiconductor manufacturing - Siemens,Siemens acquires Canopus AI to bring AI-based metrology to semiconductor manufacturing Siemens,Siemens,news,https://news.google.com/rss/articles/CBMia0FVX3lxTFBVV0lVeDRWeEtOcWpWTkpFXzhObWJJa3RhQTQ5UW90a3RWcy11dFk4X2FONnc1aWNicGtNWnhmSnc4NDZLbVJrRVF5UFhrTkFuX2x1MGZiY19naGludWx5QUkyUjlGRkZZRmNF?oc=5,"Wed, 04 Feb 2026 08:00:00 GMT"
d450ece15084,WeTouch eyes $10M-a-year Siemens projects after 5-year supply nod - Stock Titan,WeTouch eyes $10M-a-year Siemens projects after 5-year supply nod Stock Titan,Stock Titan,news,https://news.google.com/rss/articles/CBMivAFBVV95cUxNdm1BVm9HS253NVRyVms5amZwNGNidGxKMXJFaEFoX3VNMHpUZkE0b0pKdVd3NUFmRGVHQXVXYmRxSlJvXzFNXzBSMHRPSFVmdjFVV0txMVZpR05nbmMtLVYwajE3WjlWZndrWlNLVzN3OG01WUp3MW5icmNXa0VOM1JLaVBhMkN1TUZBN2FpYXk4NEUwSUpMejhYb2ZzTXdmMllGUjRMY25iWXp4d0tEQTV6czUyUVBMVW55ZA?oc=5,"Thu, 28 May 2026 07:00:00 GMT"
59265867f25f,Siemens delivers major cloud-based SCADA for renewables - Siemens,Siemens delivers major cloud-based SCADA for renewables Siemens,Siemens,news,https://news.google.com/rss/articles/CBMic0FVX3lxTFBzdVZFdFdMNWlwdU10NGZPcUhLcVJZVDJ3dkFCdzJRbXNRWjFkWUJRUWQxRVV5Ym9kY0MyMzdmSFFhc3Q4LXhMN1JvaHlIMUwtRVZIb19rTTVqeHRIXzVQZ1pWNzVsaEdwRmp1d0V5NWFXZmM?oc=5,"Thu, 26 Feb 2026 08:00:00 GMT"
b9beaba8ef9e,Three Insights on Industrial AI for U.S. Manufacturers - Siemens,Three Insights on Industrial AI for U.S. Manufacturers Siemens,Siemens,news,https://news.google.com/rss/articles/CBMinwFBVV95cUxOMXhpNFpPNk9IdHVLSUt0NXdReTY2UnFqQlh1OTBtc2prY0JhaXE1US1xQkJlekhYbGUwUDBqVlBJSEhJa1l5R0RtSWxKV3FkRUhpbWcyRF9zaXNZRW5PNGZwS2RvdEE5ZGRWQlZkUDExaDB1bWRlMEkwTHRCU19hQWtITDlMSFpmR1NFaHQtWmhybnI3V1UtbTk3dXN3UkU?oc=5,"Fri, 20 Mar 2026 07:00:00 GMT"
6f926edfd099,How automation makes leek cultivation efficient - Siemens,How automation makes leek cultivation efficient Siemens,Siemens,news,https://news.google.com/rss/articles/CBMidEFVX3lxTFBUV01YLWdrbGdKc1VXWHNqRXZqN1g5Qm9tZU5feGdfaDVJek85VUk1SDRRUjNYQldrQ1Ztd2JqYlBndGFaQzFGZk5GSzJlRnlCRzBucklTMWhGZGRxMjNpTHN6WW5yWmJqaUY0cnRNTC1TeHdI?oc=5,"Mon, 16 Feb 2026 19:13:44 GMT"
a7b129b970a2,Siemens Earnings: Cyclical Recovery in Automation Demand Supports Raise in Guidance; FVE Maintained - Morningstar,Siemens Earnings: Cyclical Recovery in Automation Demand Supports Raise in Guidance; FVE Maintained Morningstar,Morningstar,news,https://news.google.com/rss/articles/CBMi0AFBVV95cUxNaHNuLTZUZlp0ZmJ3TFptc09ueVVzWF9SQk1IOURHWDFMZWZGY2NxdnVWNS1lX2FmMjlRNmNIVTRTMVpHdnNCUFJOQXdmbnRTUnhLZXphUTBSWmpPWm1hdWhMNlViVzZQQ0V4SnQ3NXRpdEc1ZVY2Q3hvWDdVTUJFNk5QUWdyNWszeW9qdU92SUJfZzA3S29yVzVyb0dvVVZWd1FOalVXWk9PNjRqWjltaUtuVkt0OEQyd1BJdWlqdnpBbHhnN3g1ZFAxLWlraVlv?oc=5,"Fri, 13 Feb 2026 08:00:00 GMT"
489dfb29a063,Siemens Launches Manufacturing Training Program for Veterans - Assembly Magazine,Siemens Launches Manufacturing Training Program for Veterans Assembly Magazine,Assembly Magazine,news,https://news.google.com/rss/articles/CBMipwFBVV95cUxQVWpLVlExYWoyZThWNE91SXhfTUdBMGthSE1RcVFqQXBscmFOQlA5YjVtQXk4ZUFhSGUzRVpoNl9OZU51b3d3dEhtd0ZwTFNqb0tBNS1XcGFFbUNjREtDOXVFTjFGWFZtMkR1OEUzUy03RWlvWW9JNVpZNHBuS0xHVGR5eTlLWmd0SlVTSWdKQmpoNXBYc0laYVBJNnVFdjJqV2kxc1VSNA?oc=5,"Mon, 01 Jun 2026 07:00:00 GMT"
28c506b281fa,SIPROTEC Process Bus Expert Tutorial - Siemens,SIPROTEC Process Bus Expert Tutorial Siemens,Siemens,news,https://news.google.com/rss/articles/CBMiugFBVV95cUxOeFFsNklSLTBLRDVkalFuMFlNTm03MldBeTdwZ1RRTWRfYkFKT0xBR1c2dWpkODItRi1oemJ2ZTRuNG9IZkI3VW1rWU5WYTBxZ0h6bEU4OGpaWDhKRkNvckhfRUVTd2F4Tk1sRFJTckNGRTk1bjZLYWdGaXFya1FhcV9reTJEUF8wWDNsRmdQS3pqdDhoVWZjRTF3OFJZWkhVckFfbWN3LWNxXzBPT19IaktEaDFlZEhjN3c?oc=5,"Thu, 26 Mar 2026 14:34:50 GMT"
7272251b5d30,Siemens unveils technologies to accelerate the industrial AI revolution at CES 2026 - Siemens press,Siemens unveils technologies to accelerate the industrial AI revolution at CES 2026 Siemens press,Siemens press,news,https://news.google.com/rss/articles/CBMivwFBVV95cUxNWUl4Q2NONi03VDladkJlXzFVMWZpQzZHeGN6blhyQjZhMGE3cXktdFFHUVpqWnBWVEtUZzBWYzBVenNwMHNLVzNUenBYb0NuUjdyRGhLeGlCV0dZZ3V0NXRaNlZUbGV2UUlqdDJ6ZWNFODZRSjNTTmRJYkdROXlPX1pPWDRfMlNKb0NhUWFaNnZMdDlrNE1MeTVYQlBub0dmdm5tSUlHLWFfdWZUM1p4SVB5T2UyWkVmbmhVX21KTQ?oc=5,"Tue, 06 Jan 2026 08:00:00 GMT"
560814cc5bfc,Building automation and control systems - Siemens,Building automation and control systems Siemens,Siemens,news,https://news.google.com/rss/articles/CBMif0FVX3lxTFBjNC1NR3hpdlllX0twU0lGdTZ3U05RWm9ZaXRyM1ZJM1BuWFMwbEVsM0lfWHB1U2xZdk5CYUIzazFOU3dxcEd2TS00TmMwa2g2S1dGRmdtUk1WdzRCa2JtQzdFNnB6UFhkMmFYdUlKZjRWRHozamZHQWFRNV9Tb0U?oc=5,"Fri, 13 Feb 2026 14:49:39 GMT"
7fe15bf7a50d,"ATG Airports, Siemens and Parmley Graham Deliver PLC-Based AGL Control System to International Airports - Airport Industry-News","ATG Airports, Siemens and Parmley Graham Deliver PLC-Based AGL Control System to International Airports Airport Industry-News",Airport Industry-News,news,https://news.google.com/rss/articles/CBMi0gFBVV95cUxQV210d21CSFBabUZsSHN1UTNuajdxS2dsQndFV0haZFZPOUZra2tyZ1BCSVJBVE5vX1RYTzZpZk1mUFNBeTdKenFYNmx4eHl5OW5GdjhxQ3RPNktZYjlnUGZ0S0ZSWW5tcWRsY1RFbXBBOG1OUjNMbUlZYlktaGVfWUlLZWdxX2g3VlhvU1I3cnFETEFBZ09OXzBjdnhqWGZielQ3aU5ud2J2WUhOT3dJWWt2aGF2VHVzaEhtV3JkbDVJM3lKb0xSQmt5NkRwdmVUZkE?oc=5,"Tue, 02 Jun 2026 07:00:00 GMT"
86147918ef64,Salas O’Brien Expands Partnership with Siemens - foodengineeringmag.com,Salas O’Brien Expands Partnership with Siemens foodengineeringmag.com,foodengineeringmag.com,news,https://news.google.com/rss/articles/CBMinAFBVV95cUxQc0YxQXJWY2daaTdKWGVPZ3B3Rm1mRm50TTJ1TldWckUtYWFja1htRC1yajh2aVpqaWpOQ0Jpdm1EbE0yY3M4ZjFVcWR2V0ZPLUN6S3JDcmhMRnVrM1k3VTluWDhQcE1xVUNXWDFJd005ZkZvQ1RmclpJemZZSVg3UTJra29CNUQ2UTc1RHV6Y1o2a05mMnJldW1HOHQ?oc=5,"Thu, 04 Jun 2026 14:32:00 GMT"
ef1b540d8a1e,Siemens Boosts Outlook on Data Center and Software Demand - Bloomberg.com,Siemens Boosts Outlook on Data Center and Software Demand Bloomberg.com,Bloomberg.com,news,https://news.google.com/rss/articles/CBMiswFBVV95cUxPSm5vTkdZdmRhbGlobDRwaThyTDlVQjdlbXgyRzd1Z1FpT1g5NVQ3a0Y3QXR1RGVvdl9oV3hQbkNNQnVsTVJvM0o0M1NodmRycTlaeFdMWnRMVE9aU0hUckc5b2lwSFRnRGhDTHBIY2tUR2h4ZG91SEhWX1RrOGU2eVpsLVgyOENRVTVoTFh5dDNraWZtZDhSQjFjdEpOY090UV9hNHFYWmEwdDlHOHVGdWJQMA?oc=5,"Thu, 12 Feb 2026 08:00:00 GMT"
651ba3d59c04,Siemens unveils industrial AI innovations at CES 2026 - Siemens,Siemens unveils industrial AI innovations at CES 2026 Siemens,Siemens,news,https://news.google.com/rss/articles/CBMitgFBVV95cUxObzVzcUdqT0daeFF1TWZpY2VaUk5iUl9faUxwM19HUmd5cDY5NlpJaGk4MXRsd0hVVG02a1ZhNnVDS0NMdTdlU1p3d2VwXzJqS0VwcFBSdVgxQlpuN1BpVzF1YnVyVndYSGRwVWxhbjB3cHdpZ1JDOUdLRVlyNF9XTHdCT0d0VFV3RUN3eU9tajhTUVJqVlpGQ1pWN1NUZWU1YnVGQnVGWUNwN1ByQmFIVTh0X24zZw?oc=5,"Wed, 14 Jan 2026 08:00:00 GMT"
aa1b7192a1eb,Siemens to add 350 jobs across Carolinas - WRAL,Siemens to add 350 jobs across Carolinas WRAL,WRAL,news,https://news.google.com/rss/articles/CBMisgFBVV95cUxOSTZVdzF5X19zMmNaZmhaNktKazJIbFdWSGQzMm5vQW9NQjAyQjl3U1VKMDVQdVowRFNsVTItV21TR2FqYVRsRGFiZHVaUmF1RjN6ZDh4Y0R0S05INUQ3VXVfRWQ5eDVqeHVaM3FSeWs2R0hJblZtdUQyZFJrM3pPekE4dHVOVm9sZ21JSkFnZi01RDNPWVF6amNTUWl3T0RybVM3ZXdjQjRIaUVvclE2MlZB?oc=5,"Tue, 17 Mar 2026 07:00:00 GMT"
af18b1c43551,Siemens orders rise more than expected despite Iranian war tension - Reuters,Siemens orders rise more than expected despite Iranian war tension Reuters,Reuters,news,https://news.google.com/rss/articles/CBMilwFBVV95cUxPZEl4OEFBWU9UMlVDcnRZd3A4N1E1cGllbHN4cmhrcVAydWx3SWRtaFBOTFZsYi1OUXA1WUlCUDFOWktiN1VUV3lHckNMNnZnMlRXZDU1eXJieXdpYkhheHlKc016UjVkMldkejd6UllSYzRLLWpudXBiTXdyTDVYa0wwWGtiQ1JGZEFVWk5WQ0poWVVqVXMw?oc=5,"Wed, 13 May 2026 07:00:00 GMT"
c939cc66ac95,Siemens expands Industrial Automation DataCenter with edge AI and cybersecurity - Help Net Security,Siemens expands Industrial Automation DataCenter with edge AI and cybersecurity Help Net Security,Help Net Security,news,https://news.google.com/rss/articles/CBMijAFBVV95cUxQUW5MQnE0WlJjTndSRThqV2luSFl2aFB4TGJyUkhwNVJQVEhEZlBlVDFSM280Nk5ZZ3lYWHBQd3dFZzgxT1hmS29HNkpBQTBteE5yeWRSRjhRUFNJbklwMDdsOHdHRHJucDV4UDRrcTNKT2IzMEdwX2JDYnpTMzlIN3l3YUdGeXVLWWlfOA?oc=5,"Mon, 13 Apr 2026 07:00:00 GMT"
f671845ae5e8,H2 Core Systems Builds Scalable Hydrogen Energy Solutions with Siemens Xcelerator - Fuel Cells Works,H2 Core Systems Builds Scalable Hydrogen Energy Solutions with Siemens Xcelerator Fuel Cells Works,Fuel Cells Works,news,https://news.google.com/rss/articles/CBMizAFBVV95cUxPNW82MmhGQzdPQ0VkWXdBeXVXWDBDYUg2d2R2aFAtbV9OcUdRb0VsZXlNZXRKLTQ1OUxzMDhiQko3b3lpTTRGcXhITUlTQ2habjlCNnFHOVBOb1E2d29kOFdVU2d0SS1JUnBMcURvZmYxeXRpaHBiMEYxdWUwN3B4NWs5SVdNNGVnRHR1cWx2Uk1KbnJjOG1iTVEzLThTOUF3eGdNeV82d1FGODRBMDNVMGl3OV8zb1pVbDhJWk12eEVvSGlzSDV0ZVd6Zmg?oc=5,"Fri, 22 May 2026 07:00:00 GMT"
8a9411d31127,Siemens introduces AI system for automation engineering - AI News,Siemens introduces AI system for automation engineering AI News,AI News,news,https://news.google.com/rss/articles/CBMimAFBVV95cUxOU1VvNXR2Y0xEdFVWcUdMbGFyUmcxam90dkhSajBkWDh1d1NseTg0cFJ0M3ZpSi1COTRYdTA1Zlc3YkN2aFpWaVVpUFZ4MUpFbE5LaGl0dXZZbTUwamI4QzNjREZscWJXQkxoNTlpUktEeldOcVJHYmdHSjYtMk91R2g0aGxhM2sxVUl0bVdJRXd4RFNhLXdJMw?oc=5,"Tue, 21 Apr 2026 10:03:23 GMT"
29b6a295ffac,Siemens’ Evolution Into a Modern Industrial Automation Titan - Thomasnet,Siemens’ Evolution Into a Modern Industrial Automation Titan Thomasnet,Thomasnet,news,https://news.google.com/rss/articles/CBMibEFVX3lxTE5Qa19EMGJmMUZVOVNKNkMzVDh4QjBVMElNWFJBX01YVTFRNncxSzBTc3hNbmpldmJxWWNuS3Jzd0Exc2dhenV3R1ZBV3pRNTFsNmpwbEJTbHdwU3JIQWhySG93RzRHSnQ0VzR5aA?oc=5,"Mon, 20 Apr 2026 07:00:00 GMT"
e0f37fee7038,Siemens and Stadler consortium to deliver fully automated trains for S-Bane Copenhagen - Siemens press,Siemens and Stadler consortium to deliver fully automated trains for S-Bane Copenhagen Siemens press,Siemens press,news,https://news.google.com/rss/articles/CBMixwFBVV95cUxOV1g3b1Y0YTRKY1VONGFwNnRPZnhiWFBMX1hfSVAzNnY2djVrOUw0d1RqVXFMck1lWXduYjFNVEU0eWdDbk94X3p1T3V0d2Z0S0RYMlVPdW4wd2F1MUdfaEJiSmsxb1hLUEJGRk96NFB6MHRwbDh4aXNYV0NIeVBPaHMzTGhLalIzWkFxaU8yaWdKdUN3RjhIRFNNd09Md1BJNW5Nd19wWHhFcE8tLW9EajJfX1p6ZHFUT3E4T2dYWkVNaHprQ0dn?oc=5,"Fri, 06 Feb 2026 08:00:00 GMT"
4a9e79b41e32,School Tech Awards: Technological Innovation for Students - Siemens,School Tech Awards: Technological Innovation for Students Siemens,Siemens,news,https://news.google.com/rss/articles/CBMijwFBVV95cUxOYy1TOWN6eFdyNDNjQ3l3OHNxTmV3UHVBRG84UU53MVlhVl9acjBBWjNrZ0xyNThLSG5PLVpkeVJGZS1CWFgtZXVRNmc4OUlYU05WNDQ3dG1aVHJ5eGpBOTBiV3BtcEcyV0h2dzNhSXlfODRBWEdTdVhIcWUwTHNQT1IzUkdiVEJqZXN3bzltOA?oc=5,"Sat, 14 Feb 2026 06:01:22 GMT"
c362fc364412,"SPS 2025: How Siemens, Beckhoff, Rockwell, ABB, and peers are positioning for industrial automation’s future - IoT Analytics","SPS 2025: How Siemens, Beckhoff, Rockwell, ABB, and peers are positioning for industrial automation’s future IoT Analytics",IoT Analytics,news,https://news.google.com/rss/articles/CBMimgFBVV95cUxQVElLaGxaZVFNa0NzMkJJeGl4Nkd2QV8zYVpfX1YtNzJZb25WX1AwTG9QclJnVXRQT093YU9qc2lRcU1NQXdCeU5faEFxc0RhNm9BOGhoM0RBZzJub3BEMXMwNmJKUHBFUmp3aEgzRXRJYXc0eG0zUzcyM09mQ3BZeURVMjhwRXhOWUJ4VmpJS0prMzJtVUF5RjFB?oc=5,"Tue, 09 Dec 2025 08:00:00 GMT"
529a0598bd5e,Accenture acquires Siemens Digital Industries partner IndX to deepen manufacturing technology expertise - ET Manufacturing,Accenture acquires Siemens Digital Industries partner IndX to deepen manufacturing technology expertise ET Manufacturing,ET Manufacturing,news,https://news.google.com/rss/articles/CBMiiAJBVV95cUxPZ2NXMkxTU3lXSjFyel84WkZmX0wxQ3lSZlJhUDZaVlluS3ZMeFpodFNVMFZLUGlJa3VzaDAwVWtqbXdleEtZSDBmV0RkQTJGTUdfUlFUVjhYNUZGR20wWHdYYUV4bkNEeTZZOEx6MmczMUN2TGViRE53OHRHd1dmcXM2VFlpeVM5dWVPUUhOSGU1NzBBTnFlaXVHX0U0U3dJM09GZmpsRWNjWV9KaEpzRTJVVnl6eGlYSG1rQnk1d09mRUxucFR6MWpHZHp4ZFlmZ1E2Q2lIdTRXZDVPbG1CQTY1WnhsNm9XOFB6d29zcmZOeV90ai1hcUJXUlh1Rm5FeTlaRGFBdlPSAY4CQVVfeXFMUFdLbFd2WXhocE0zUWVPdjJCSzd4NVdnSUJxREl5UlhTcW9ZZHhhcVZnSndjR2NibmpzMm9TVzBXU3ZYWmJsc2JYTHYxbFBPbUtwaXF1dHpPeC1iaG90aTNBODlaT3cwYi1DVXRkOEUwSDRPUndhdHFUVHZDQ01XZ2xmYnpPWVFOV3E2VlFsVldpTGxPN283a1F4aWhCRkh2aHRHVlp1X0YwQVg2aHNBU2JHZzI1WFZHcllUUkdvUGRtMGNPNk12Z2NGMEV6SnZlTDItd2M5Y2JLck1PZ0ZtMEo3QjUtZ2ZYYVctZzc1aEM0MTA0dGVjZlZNNFdRSTgyZlBwVV9jZTh3N1J5WGJn?oc=5,"Wed, 17 Jun 2026 14:13:20 GMT"
72d56176e619,Siemens and SCAMM: Defining New Standards in Automation - Siemens,Siemens and SCAMM: Defining New Standards in Automation Siemens,Siemens,news,https://news.google.com/rss/articles/CBMijwFBVV95cUxObVpJVzlPZjhmTUdvQUNBaVdfN3FLODhZb01WdS1ydENibmszeVRTaTJBZlEwLTZPU1VzcVg4UjYwSlpYSThMbXlLc3I3ZVJUaDNFOF9CY2FVdXBaNlR0cnZGX2stNVd0MGI4NndJVjJGYWRuSHZ5RGUwVmV0Qlk4VnJsQ1J4NDl6VDNHR2NfTQ?oc=5,"Thu, 19 Mar 2026 20:49:30 GMT"
b5525bf37107,Siemens gets physical on industrial AI - Mobile World Live,Siemens gets physical on industrial AI Mobile World Live,Mobile World Live,news,https://news.google.com/rss/articles/CBMihwFBVV95cUxPUmlTUF9ZcDRubHFDVXFWU1haQnlqN3VpMS1IMGIyb2xHYVRhSUFSc1UtRXVXeDViWnNnM3V2T3VnRnRmQ2I1RXJQdmk2VGFKWW4xNXBVY25pZ2JWbFpOTW15N3RUQkc4UExkZ3A5cmtDd3ZsSjlDTmtKZ3lxY1MtX0JYZXI3c0E?oc=5,"Mon, 20 Apr 2026 07:00:00 GMT"
b77163528c7a,Siemens unveils Digital Twin Composer - Siemens,Siemens unveils Digital Twin Composer Siemens,Siemens,news,https://news.google.com/rss/articles/CBMib0FVX3lxTE5jcWE0NzZnbUZ6VEVHdmFESW5OYjNiTk1WNktkeFJjZkVZODJSajE0d09UdXpOLXctZzFfSGJMVGpoYnRlVEN1eFhjVWJYR3VNMGFlTngxVC1KRHpoWnBVTXpsOFhtblhJbWFhMHhMZw?oc=5,"Tue, 06 Jan 2026 08:00:00 GMT"
af964d39f9c0,"NVIDIA partners with Akamai, Forescout, Palo Alto Networks and Siemens to target real-time OT threat detection - Industrial Cyber","NVIDIA partners with Akamai, Forescout, Palo Alto Networks and Siemens to target real-time OT threat detection Industrial Cyber",Industrial Cyber,news,https://news.google.com/rss/articles/CBMi1gFBVV95cUxPZ3Rjd0Ewb2RZM2ZMb0pXdnBBTlF2dm9DQ1k4MWdtVHZBNG1DXzZLbkY3QjlmODJHdnFuOFdieUtzMWhOWkloRWNZZm1MNnBMcC1OYi1PdHRwMmRoNUJKS2NHdkl2UE9xcC11WG9naHZ0YlVVakxLWDZvMFlrNlBRZG5iS0E2NTZmTDBoWnRWd2NhVXBmX21sbGE3ZXNWQnhTNmNfUFVWZFJlTXBBU0NST1RvQ01NSDdzbi1hMTYxU0g4dVNUVG9Tb3JLWUxYLVFsTUlsOHF3?oc=5,"Mon, 23 Feb 2026 08:00:00 GMT"
85d94552cd33,Aspiring inland waterway skippers learn to dock safely - Siemens,Aspiring inland waterway skippers learn to dock safely Siemens,Siemens,news,https://news.google.com/rss/articles/CBMiigFBVV95cUxNSFhxQnU5RC1weUo2ZVQzVC0yeW5seWk0MEtaazA1dkdPUmRJbWJ6LUNCamxXZWRmN1Yybm5vektFU2VudTBNMERMeEFPRzZsMUotdHA3Z1FvWjhIb2hDTzEzbUJveW1YamFsRmZzc0xjQkJNQ2FISFpLVFE4YzZSZHRHQzdTcnVyX0E?oc=5,"Wed, 25 Feb 2026 20:15:00 GMT"
593aaf02fa65,Why Siemens's CEO Thinks AI Will Shape Company Operations - Business Chief,Why Siemens's CEO Thinks AI Will Shape Company Operations Business Chief,Business Chief,news,https://news.google.com/rss/articles/CBMikAFBVV95cUxQR0NyTDR1T0dRRFFQRFRoYjZLMUFENHc3Z1V3NmZveHA5RTI5SW40ZERVY0k4NmtJLTV5UlJuSEdLbFVzSGpMQWtUTUQtWGVrM3laZGtFdVVUM1B6UzktLWJXUi1XbHRfUmpDZzZBdGdTOTZPN1Z1aGZheXhkN2NOVmM2NFlUeE8zZURBMVR1OHA?oc=5,"Wed, 22 Apr 2026 07:00:00 GMT"
014b1e1c6150,Siemens adding 350 jobs in Wake County in support of AI and data centers - Business North Carolina,Siemens adding 350 jobs in Wake County in support of AI and data centers Business North Carolina,Business North Carolina,news,https://news.google.com/rss/articles/CBMinAFBVV95cUxOa3BKU3pSUm5rWmxMRTI2RElNMDJXU1FKUV9DQm8zYmN0c2I3UFNFVGV5Ulk2ZFYxWHZ1bmpKSS1xa1hUUnBsVWttUE9SX0gwLXFST3JDU19WX3dPb1hJY0Nlb3JpSkF5QnFqN1cyOHBQVXFVS3dEdTNhYUllRkJudzNFM0M3a2Rnd0lzQy1qM1dPdFU0OUwtVlh3a24?oc=5,"Tue, 17 Mar 2026 07:00:00 GMT"
14d07d9a5bf4,Siemens and TSMC expand AI chip partnership - gasworld,Siemens and TSMC expand AI chip partnership gasworld,gasworld,news,https://news.google.com/rss/articles/CBMilgFBVV95cUxNV1M1MHNCUF9zd2FDcWVhYkx1aW1sZjB1Sm5qQ3pRZHF4TXhKNFJnNlU0QWsyVHpCZ1ZZWEo3MmFhUGFTSGZoNkVKcWZNLTB4R3FPTjU4d0ZaWEhFUGpMVjdSRVdPOENYeGdGTmFJcVI3Rktwd0I2WS1iMjRROXM5UUx6djJ1V1lkU1hmcXRVUEplaFF2SHc?oc=5,"Thu, 23 Apr 2026 07:00:00 GMT"
3ab45314f525,Keysight joins Siemens software partner program - Engineering.com,Keysight joins Siemens software partner program Engineering.com,Engineering.com,news,https://news.google.com/rss/articles/CBMiggFBVV95cUxPd1VoaHk5bnB1bWFoeUJHMjlwSFppVmJJLWk1MlJnWExtd3VQWWQ5WXN2dHBod01PN1BuR19vY2VnVWdJZE1zMmJqTkFFcjE5S0d6amxndWJoWmdtVzlscW9KQndNaTBxSERiVmg4VV9zaVZ5MENkMmNpXzJZQzV4b0Nn?oc=5,"Wed, 17 Jun 2026 16:07:40 GMT"
3f98b3b5c878,Accenture to Strengthen Capabilities for Software and Automation Solutions from Siemens Digital Industries with Acquisition of Industries eXcellence Group - The Joplin Globe,Accenture to Strengthen Capabilities for Software and Automation Solutions from Siemens Digital Industries with Acquisition of Industries eXcellence Group The Joplin Globe,The Joplin Globe,news,https://news.google.com/rss/articles/CBMiygJBVV95cUxQRm11bXU0cFQzLXNfZFRWS0NhWXZxMDVyYklLMWpZQkExaUhTeFhlaE9JaHNUbmR3bG1POVF6VGFXenFteVktRkc4dk4xd0d1cFVSZjgteHpaNDJQeXdmZW9fS0pQbkxDOFNuX2MwOVZIYTAwRm5GNGpmOFNzWEk3SUdIcWdHSFU0bTQ3R3JIQ0ltdTRxbXFBaWl2Ny12Ylk0Skp0QlZkVk9WLUg1VVA2THgyc2RGbFVlZ2hlWHpXVERfSHRLS3VuM3pYY1BBTVBORDBKOXloMDhRVEdwWTBvcXVLQnJhYkpaQTkzaVlnWFNpaTU4WXBiNExSR205YTNTSjF3cFNPY0ktZHUxdlJObmtENjZGVFp4YmN4U1hHcUEyLU1Uam9BQmFjU2ZFS2hLUVk5cFVmc05qclcyYUtpYVkxXzIyOGtMTGc?oc=5,"Wed, 17 Jun 2026 07:49:40 GMT"
12f57e6dd311,"Siemens plans reorganisation of two divisions, says source - Reuters","Siemens plans reorganisation of two divisions, says source Reuters",Reuters,news,https://news.google.com/rss/articles/CBMioAFBVV95cUxNYTMtQVoyZmZsVGVqZGdHOUFFWG5wZlJVVHFEU3NRbHFkWjQ2dzNhOGpHRl9CakRQOTBqUER2YnJpczJIT3Q1YnMtSjRuVEF5b0poVEcxUjlsaXp3LVBfOWdmUlBHUTdyUTI3b09vZ3R1enBkSlAyXzdadVFXTmZWNVBHYWZPTTBKUm1NRTFENzR6QTRoMC1HN1J2OHhkVnlv?oc=5,"Mon, 30 Mar 2026 07:00:00 GMT"
a6ace0755555,Siemens partners with Databricks and FFT to turn production data i ... - Siemens press,Siemens partners with Databricks and FFT to turn production data i ... Siemens press,Siemens press,news,https://news.google.com/rss/articles/CBMizgFBVV95cUxQX3FIaTJaYjBuaV9YZHhzdUplN1JadS0zQTQ0VkVSTDBiYTVweHp3UjRaQTR5djh3QjVqOUppWmY2Q0JiSDRyOG15NDBsODF1NjBjQjVydDBwUDFzUEpRbUp0aUV3NjhqaWV5T1hwZFRPbEFRY0FFQzR6RXdrR3lLN0hHUE9jeGN1WkpmZVlnR2g5SGVvaVpLWllKa1ozXzFrYTJ0cjNSTzFESW9Bc1gyM21nNnpQWUJJeVdydi0zVUtaTjVpTHlrY0dwc0tIQQ?oc=5,"Tue, 16 Jun 2026 15:35:22 GMT"
6c8358d07e05,Siemens is a Leader in Gartner Magic Quadrant for PLM Softwa - Siemens,Siemens is a Leader in Gartner Magic Quadrant for PLM Softwa Siemens,Siemens,news,https://news.google.com/rss/articles/CBMif0FVX3lxTFBobUxtanI1cXNsS1hRa0dVSzRrTzNtMUo0aFh3cFB6QnlzWHh0QnBid3dkTXF6NzQ2MmtDcDMxX2ViVjlGX1JON0dhdjIxZ1JkNzFwMENBclVCQU5GNmxmTVhWT3FPamZlMDBaa0JrUVNnUFpoTERJRXI3OG0yLTA?oc=5,"Wed, 10 Jun 2026 12:32:02 GMT"
961d59089f03,"Siemens opens new office in Saudi Arabia, accelerating digital transformation in the Kingdom - Siemens","Siemens opens new office in Saudi Arabia, accelerating digital transformation in the Kingdom Siemens",Siemens,news,https://news.google.com/rss/articles/CBMia0FVX3lxTFBxejVCaWlkODdsdXNyUzVmamEtNEEtQzRUV1lBLU9RbjRWSVZ3S1hEVDhBaG1BSnVDdnQyRHhNVXJVdWprUkRJUlpCd0I1OEJYNFdIMmRYNDhWSXZsN1hTTUZTNzdJTEpOLXdR?oc=5,"Mon, 02 Feb 2026 08:00:00 GMT"
fd2bb9add82c,Accenture acquires Industries eXcellence for Siemens digital industries expansion - Express Computer,Accenture acquires Industries eXcellence for Siemens digital industries expansion Express Computer,Express Computer,news,https://news.google.com/rss/articles/CBMiyAFBVV95cUxPYUJLSTJCVXZuNVNhN21NYjZsMHFhVjZjZlRpcnhsM1kyeFBrbHpSUFdNdHoxbEtVMVFZazd0NEZ4dzdPM2I2N0xKVzJScWNaenJGckplV1lrWFRxa1ZQWFpXc2pYVm90NmZTdDh5YXpkeXFfeVAyajRyNTdYYnBsWkhVeDdQQ2VkcVF1QnphemFwWmk4amRUdUh2TlBPeFA2Q1BHVzNRM1hUN0ZScW5PWnBvWFpvdWgxZ3RmdDA5V0J4VVpuUDVJYdIByAFBVV95cUxPYUJLSTJCVXZuNVNhN21NYjZsMHFhVjZjZlRpcnhsM1kyeFBrbHpSUFdNdHoxbEtVMVFZazd0NEZ4dzdPM2I2N0xKVzJScWNaenJGckplV1lrWFRxa1ZQWFpXc2pYVm90NmZTdDh5YXpkeXFfeVAyajRyNTdYYnBsWkhVeDdQQ2VkcVF1QnphemFwWmk4amRUdUh2TlBPeFA2Q1BHVzNRM1hUN0ZScW5PWnBvWFpvdWgxZ3RmdDA5V0J4VVpuUDVJYQ?oc=5,"Wed, 17 Jun 2026 19:50:10 GMT"
c35ea88de58d,HD Hyundai selects Siemens Xcelerator for integrated digital shipbuilding platform - Siemens,HD Hyundai selects Siemens Xcelerator for integrated digital shipbuilding platform Siemens,Siemens,news,https://news.google.com/rss/articles/CBMieEFVX3lxTE9uZ0dyNU9GdU9MS0NVcmJwYlFHR2U4cmJLdkdaVWNYRmk5dEJrTC0tN2d6djB1U2d6VHZGUFBhNlh0ME5jSFNaRnpWRjJOS2N3Zld1Y1Z5ZXBJeW0wNmxyeU82VmJHQWZnbGZjRmdnTElwNEl1LUtzTQ?oc=5,"Mon, 16 Feb 2026 08:00:00 GMT"
4ef23a7e5f14,Siemens and HD Hyundai MoU - Siemens,Siemens and HD Hyundai MoU Siemens,Siemens,news,https://news.google.com/rss/articles/CBMia0FVX3lxTE5RZXZ6ellTb05xU3ppVEVUV2ZpWUh5OERQQVpCMFJfM0VUZUhRdVExRFZqcm9UOUdLSnUyV3dHVlRtYnVnNHlqMGVSWEVnNFRMYl91RmxRLXdEd25oSkpwTFhvVFpyUFZZeXJ3?oc=5,"Mon, 03 Nov 2025 08:00:00 GMT"
c1f788bd4fe5,Haddy scales AI-enabled adaptive microfactories with Siemens Xcelerator - PR Newswire,Haddy scales AI-enabled adaptive microfactories with Siemens Xcelerator PR Newswire,PR Newswire,news,https://news.google.com/rss/articles/CBMixgFBVV95cUxQMEg5RXFSUEZFeHhqU0QwV2NHUmRIanc3eWlDZDFKRWEzdGRNZl9JV2Nyb2J2TXlCbmlhQXVFTkhmTnpiT2JHWGx1M1d5cGI2VjI4ampLamx0bGN1M1JhX2NJRmlUN056ZnQ3a2p0NEQ1elN5bGRCclpDbWV0TkhZNW1mcmE5WEVoc0hqQ0loa1QtZDdzNDJVWkZidWpBZFNSUUtndFN5RGZueksxUWsyWGQ1ZXJjUkg5NWI0Zng0NUtmdnFDRlE?oc=5,"Mon, 01 Jun 2026 07:00:00 GMT"
626266a97dd3,Siemens brings unified multiphysics and optimization to the cloud with Simcenter X - Siemens,Siemens brings unified multiphysics and optimization to the cloud with Simcenter X Siemens,Siemens,news,https://news.google.com/rss/articles/CBMic0FVX3lxTE9DV3U2NG91VEN3TXh3Mk1tekZxRnVEU1dsVV9mNElUdEE1cm9BcHhRaFZtT1JRcWs2YTYzQ0ttdVB5OTloZ1JEY2Y2LUthcW9JVHNYd2swVmpKSzIxR2dCT3dNRnB2NHpRdjY0eUZIM2FMRkE?oc=5,"Mon, 01 Dec 2025 08:00:00 GMT"
bee0105a7cb2,The Context Layer and the Agentic Foundry: Siemens Operationalizes the Industrial Digital Twin (Realize LIVE Americas 2026) - ARCweb.com,The Context Layer and the Agentic Foundry: Siemens Operationalizes the Industrial Digital Twin (Realize LIVE Americas 2026) ARCweb.com,ARCweb.com,news,https://news.google.com/rss/articles/CBMiugFBVV95cUxORmlFTEFIWEFpMUpLTVg0LTNhd3JFV3d5Z1l1MmRTUnE0V3lEVzZKZzVLdzZ1T3lRaXVxZ1AzaUNjVjFaQ1dWcDJ1d0dUc1B5Q2Nzdnl4VmR6djM1cVBiVXUwZVREYzhQUjFHSEdRMG9wVjNwVE9kV1dJTjRJemtXOXBTTXRYRXhUT2hQbUV0X1JnSDdzaEtRdmpWbW1EWm5kOEd0OE9qc1VubWI5SjJhcnNRNjJQOEN2OVE?oc=5,"Wed, 10 Jun 2026 12:00:00 GMT"
8eaca504caa5,Siemens Launches SMB Production Optimization Starter Pack - Siemens,Siemens Launches SMB Production Optimization Starter Pack Siemens,Siemens,news,https://news.google.com/rss/articles/CBMikAFBVV95cUxQZ0VXQ1FZellKOEYwWWF1bWt1aDNESm52eUlKRzNsYnZfY3VYR0NNRTNmLVpQNWFUSGlBZEl2SnpJMXpZQzBZWm9PbzY0N2gxWW9Fc01JU29SOFhqRWxKU2djTGNqT0N4Vmx4RVFmcGFLUGF4ei1oeDZhY01WTnFGNDZDSHYwTENTaHdPYXpGSEg?oc=5,"Fri, 14 Nov 2025 08:00:00 GMT"
